CODICE,DENOMINAZIONE_RICHIEDENTE,CATEGORIA,TIPOLOGIA,DOMINIO_RIF,PROVINCIA_SEDE,COMUNE_SEDE,TITOLO,MANIFESTAZIONE_INTERESSE,CODICI_EQUIVALENTI;;;;;;;
"RFB_465,Associazione Di Comuni Città Policentrica Jonico Salentina,Ente Pubblico,Altro,BCUT,LE,Sannicola,SAC SALENTO DI MARE E DI PIETRE,""L'azione bandiera del SAC Salento di mare e di pietre prevede la creazione di una rete di servizi per il cicloturista da realizzare su alcuni itinerari ben definiti e già fruiti e che attraversano i comuni del SAC. ";;;;;;;
Gli itinerari saranno finalizzati alla valorizzazione dei beni culturali ed ambientali attraverso il rafforzamento dei nodi della rete e la ricostruzione dei collegamenti mancanti:;;;;;;;
"'	quelli materiali costituiti dagli itinerari cicloturistici";;;;;;;
"'	quelli immateriali che per l'azione bandiera sono rappresentati da un 'racconto' che unifica le storie di cui musei ed aree archeologiche sono le testimonianze e che viene indicato come 'il racconto del mare e delle pietre'.";;;;;;;
;;;;;;;
Obiettivo dell'azione è quello di incrementare l'attrattività di beni culturali di rilievo, inseriti come nodi della rete di percorsi cicloturistici,  che oggi sono fruiti in maniera discontinua o scarsamente fruiti.;;;;;;;
"1.	In particolare alcuni beni facenti parte del SAC come i siti archeologici di Parabita e Matino e l'Abbazia di S.Mauro a Sannicola non sono attrezzati per l'insediamento di servizi permanenti. La localizzazione isolata dei beni che richiederebbe opere infrastrutturali non proponibili, l'alta valenza paesaggistica del luogo che richiede una progettazione minimale di ogni attrezzatura impongono  un ripensamento al concetto di valorizzazione. Sarebbe importante poter usufruire di sensori, di giochi di luce, di apparecchiature in grado di reagire a stimoli ambientali e poter far funzionare le apparecchiature con sistemi solari non impattanti. ";;;;;;;
;;;;;;;
"2.	Tutta la segnaletica del SAC, che è contemporaneamente segnale e valorizzazione,  potrebbe essere integrata con  applicazioni ICT intelligenti ";;;;;;;
;;;;;;;
"3.	Le applicazioni ICT potrebbero facilitare il raggiungimento di uno degli obiettivi principali del SAC: la tutela della rete dei beni e del paesaggio passa anche da un patto etico tra cittadini, che a partire dalla scuola formi i veri custodi del paesaggio. Sarebbe interessante sperimentare come le nuove tecnologie possono incentivare comportamenti virtuosi secondo l'approccio 'dell'adesione volontaria'.  ";;;;;;;
;;;;;;;
"4.	Alcuni servizi innovativi al cicloturista come il cycling cafè e le ciclofficine, sono luoghi idonei alla sperimentazione di relazioni positive tra tecnologie, design, inclusione sociale";;;;;;;
;;;;;;;
"5.	La rete dei percorsi e delle connessioni deve essere di facile accessibilità e connettere secondo un piano intelligente dei tempi e degli spazi le stazioni ferroviarie, i servizi, le biblioteche, i musei, le strutture ricettive, gli eventi, le attività economiche connesse al SAC. ";;;;;;;
;;;;;;;
",
RFB_663,Salvaguardia Del Patrimonio Storico-Culturale Pugliese,Soggetto del sistema socio economico regionale,Associazione,BCUT,BA,Bari,Salvaguardia del patrimonio storico-culturale pugliese,Il fabbisogno nasce dalla consapevolezza che il patrimonio storico culturale di inestimabile valore legato al mondo dei motori pugliesi rischia di venire diperso e completamente dimenticato dalle nuove generazioni.";;;;;;;
Il Futurismo ne esaltò le doti, gli uomini ne apprezzarono l'utilità e gli sportivi il fascino.;;;;;;;
Sin dai prini anni del 900 in Puglia si cominciarono a diffondere le automobili, le motociclette ed i mezzi da lavoro. Oltre a una grandissima spinta all'evoluzione di una regione fino ad allora abbastanza ai margini, si innescarono tutta una serie di manifestazioni che andavano dalla semplice corsa fine a se stessa alla passeggiata turistica, dai concorsi di eleganza alle fiere espositive. ;;;;;;;
La Puglia, grazie a tutto ciò, ha vissuto momenti di gloria sia dal punto di vista nazionale che internazionale, pensiamo al Gran Premio di Bari, alla Fiera dell'Automobile, alle aziende di produzione ed altro ancora.;;;;;;;
Tutto questo patrimonio è a rischi di estinzione, favorito da un naturale oblio e da una grande difficoltà di reperire e consultare materiali sparsi un po' ovunque.;;;;;;;
La finalità del progetto è, in pratica, consentire a tutti di poter accedere ad un patrimonio culturale di inestimabile valore, patrimonio che va conservato e tramandato ai posteri.;;;;;;;
L'accesso potrà avvenire sia in maniera reale attraverso l'istituzione di un Museo tematico che raccolga cimeli, documenti e mezzi;" sia in maniera virtuale attraverso una navigazione multimediale nella versione digitale dello stesso Museo."",";;;;;;
"RFB_749,Itis Majorana Brindisi,Ente Pubblico,Altro,ISED,BR,Brindisi,Scuola 2.0,""Il Codice dell'Amministrazione Digitale, la normativa regionale in tema di open data e open source e la restante legislazione speciale impongono agli Istituti scolastici, oggi, una serie di obblighi connessi alla gestione informatica e telematica dei processi amministrativi (registri digitalizzati, gestione informatica delle circolari, rapporti telematici con le famiglie e le altre PA, creazione e conservazione sostitutiva dei documenti informatici, partecipazione telematica ai procedimenti, pagamenti elettronici, CMS sito web e albo pretorio online, ecc.) e dei processi di apprendimento (eBook, spazi virtuali di apprendimento, eLearning, ecc.). Nel panorama nazionale, però, manca una precisa e organica politica ministeriale di settore e, conseguentemente, sistemi e applicativi standardizzati per soddisfare agli obblighi digitali di legge. Nasce dunque il fabbisogno di un Sistema Informativo Integrato in grado di mettere in stretta connessione i processi amministrativi con quelli formativi e risponda alla disciplina con filosofia open, ai criteri di trasparenza, alle norme di Amministrazione digitale, di tutela del dato personale e di semplificazione amministrativa, ai principi più innovativi di formazione scolastica. Solo con un applicativo di tale genere, unico sia sotto il profilo della gestione amministrativa scolastica che sotto quello della gestione delle attività formative, sarà realmente possibile giungere alla piena realizzazione della 'Scuola digitale', percorso oggi caratterizzato, invece, da applicativi e sistemi tra loro profondamente differenziati, non in grado di assolvere in maniera diretta e unitaria a tutte le esigenze digitali scolastiche, non a norma con i principi open data e open source e con la legislazione di settore. L'applicativo, pertanto, dovrà permettere una reale produzione, gestione e scambio della conoscenza e dell'innovazione, non solo internamente alla struttura scolastica fruitrice del prodotto ma anche esternamente, con modalità automatiche di condivisione di pratiche e informazioni tra i vari istituti che utilizzano il medesimo applicativo. In tal modo la condivisione della conoscenza e dell'innovazione non solo diviene strumento di crescita gestionale ma anche culturale del sistema scuola."",""RFB_779,RFB_780,RFB_782""";;;;;;;
"RFB_735,Istituto Tecnico Economico F. Calasso,Ente Pubblico,Altro,ISED,LE,Lecce,Scuola Digitale 2.0,""Le indicazioni fornite dalla Commissione Europea e mutuate dagli Stati membri, in termini di linee d'azione necessarie alla realizzazione dell'Agenda Digitale, hanno conferito piena centralità allo sviluppo della cosiddetta 'Scuola Digitale'. Sebbene, infatti, il 93% dei ragazzi utilizzi le TIC quotidianamente e la maggior parte abbia assoluta familiarità con le nuove tecnologie e la rete Internet, il mondo scolastico nazionale si basa ancora in modo quasi esclusivo su contenuti cartacei e approcci didattici tradizionali. Per ovviare a tale ritardo, il Governo Italiano ha definito il Piano Nazionale Scuola Digitale, come l'insieme delle misure finalizzate a riqualificare la scuola come uno dei principali motori di crescita del Paese, allo scopo di rendere l'offerta formativa coerente con l'evoluzione in senso digitale di tutti gli altri settori della società e definito una serie di misure operative (in particolare con il Decreto del 7 novembre u.s.).Tra le molteplici iniziative che potrebbero essere portate avanti al fine di favorire il passaggio dalla trasmissione passiva alla costruzione (cioè alla produzione attiva) della conoscenza, bisognerebbe focalizzare l'attenzione in particolare sulle seguenti:";;;;;;;
'ambiente cloud per la didattica; ;;;;;;
'dematerializzazione degli ambienti di apprendimento; ;;;;;;
'produzione di contenuti formativi digitali; ;;;;;;
'aggiornamento degli insegnanti  in ambito e-learning; ;;;;;;
"Sulla base di queste considerazioni, l'esigenza segnalata dalla Scuola scrivente è di attuare tutte le misure necessarie per garantire l'implementazione del paradigma Scuola 2.0 ovvero ' attraverso la combinazione di rete di nuova generazione e servizi innovativi cloud-oriented -  un luogo virtuale dove i saperi possono costruirsi in spazi collaborativi e di apprendimento, basati sull'adozione di scenari tecnologici in grado di coniugare innovazione nella programmazione didattica con nuovi modelli organizzativi. E' necessario poter disporre di una piattaforma tecnologica integrata, che consenta l'armonizzazione di strumenti di riconoscimento dello studente (identità digitale), utilizzo delle reti wireless, produzione e fruizione di contenuti e-learning, registro di classe elettronico, interazione social tra gli attori del sistema scolastico, etc.  In questo senso è fondamentale sostenere l'evoluzione del sistema educativo e dell'istruzione verso soluzioni didattiche e di gestione del rapporto scuola ' utenti (studenti e famiglie), in linea con i nuovi modelli di apprendimento e di interazione sociale, basati su meccanismi cognitivi e di comunicazione, che risentono positivamente della diffusione dell'uso delle tecnologie ICT e degli strumenti cosiddetti web 2.0 (es. biblioteca digitale per i contenuti didattici e  social network per l'interazione e lo scambio di informazioni). La transizione dovrà essere orientata ad un uso della rete intensivo ma sicuro e qualificato, in un contesto di protezione e piena garanzia dell'utente finale."",";;;;;;;
"RFB_456, ,Ente Pubblico,Comune,ISED,BR,Mesagne,Scuola e Musei nell'epoca del Social Network,""L'assessorato alla Pubblica Istruzione in sinergia con l'assessorato alla Cultura,Turismo e Spettacolo, ha necessità di rafforzare e rendere continuativo il rapporto degli studenti con il patrimonio artistico e monumentale della città e i musei presenti nel territorio";" in particolare si vuole valorizzare l'area archeologica di """" Muro Tenente"""" . Le esperienze maturate in questi anni,necessitano di sviluppare una soluzione che faciliti la mediazione educativa, lo sviluppo di attività in collaborazione tra le diverse istituzioni (la scuola e il museo) nel tempo (per uno o più anni scolastici) attraverso il coinvolgimento attivo dei docenti e degli studenti.";;;;;;
Il bisogno è riferito agli studenti delle scuole del primo ciclo (primaria e secondaria) e in prospettiva a quelli del secondo ciclo dell'istruzione.;;;;;;;
"In particolare si evidenzia il fabbisogno di una soluzione interattiva e multimediale pensata per i digital natives, da utilizzare sia su supporto mobile, sia su postazione fissa nell'aula scolastica che possa accompagnare i giovani durante i percorsi nel museo, nelle aree archeologiche e nella citta'e creare una community che consenta agli utenti della scuola e agli operatori del museo di continuare a dialogare , costruendo percorsi personalizzati a seconda del tipo di utenza e ampliando i contenuti con i propri contributi secondo le logiche dei social network."",";;;;;;;
"RFB_165,Ares Puglia,Ente Pubblico,Altro,ISIA,BA,Bari,Servizi e Informazioni per la Salute,""La sfida della sanità elettronica per i prossimi anni è coinvolgere consapevolmente il cittadino/paziente, rendendolo più protagonista, più informato e più responsabile della propria salute.";;;;;;;
Informazione, conoscenza, prevenzione, monitoraggio, compliance: su questi temi si gioca la partita per ridurre la spesa e diminuire gli accessi impropri ai servizi sanitari, per garantire equità nell'accesso a servizi più efficienti ed efficaci, in una società che incrementa l'aspettativa di vita (le persone over 65 aumenteranno fino al +24% nel 2030) ma che contemporaneamente deve gestire al meglio la cronicità (in Europa le malattie croniche provocano almeno l'86% dei morti e il 77% del carico di malattia; fonte ISS, Centro Nazionale di Epidemiologia, Sorveglianza e Promozione della Salute).;;;;;;
La condivisione di informazioni e la disponibilità di servizi mediante applicazioni di sanità elettronica si basa essenzialmente e comunemente sulla rete internet. La banda larga però in Italia ha ancora un indice di penetrazione inferiore a quello di altri Paesi avanzati e molti anni sono ancora necessari per migliorare significativamente questo dato: oggi internet viene utilizzato solo dal 60% degli italiani, il restante 40% rischia quindi di essere tagliato fuori dalla condivisione dei vantaggi derivanti dalla diffusione dei servizi di sanità elettronica.;;;;;;;
La popolazione esclusa ' il 40% di cui sopra '  comprende soprattutto anziani, residenti in aree geografiche non coperte dalla banda larga, le fasce sociali meno istruite ed economicamente svantaggiate.;;;;;;;
Integrare l'uso del web con la TV Digitale Terrestre (DTT) potrebbe essere allora la risposta alla necessità prospettata: garantire equo e sostenibile accesso alle informazioni di carattere sanitario all'intera popolazione pugliese, senza esclusione alcuna per età, livello culturale, condizione socio-economica, zona di residenza.;;;;;;;
La ricerca e sperimentazione di forme di comunicazione ed informazione multicanale (web + DTT) in grado di raggiungere il massimo indice di penetrazione rappresenta quindi il bisogno qui manifestato.;;;;;;;
"Senza dover apprendere nuove conoscenze, ma semplicemente interagendo con il proprio televisore tramite un normale telecomando nel salotto di casa, il cittadino/paziente potrebbe ricevere informazioni (aggiornamento della terapia in corso, esito di un esame, ') o inviarle (prenotare una prestazione, pagare un ticket, ') in modalità protetta (immettendo nome utente e password e/o tramite smart card)."",";;;;;;;
"RFB_605,Ordine Dei Dottori Commercialisti E Degli Esperti Contabili Di Lecce,Soggetto del sistema socio economico regionale,Altro,ISED,LE,Lecce,Servizi innovativi per la formazione,""L'Ordine dei Dottori Commercialisti e degli Esperti Contabili di Lecce intende erogare ai propri iscritti servizi innovativi per soddisfare le seguenti esigenze: (a) effettuare la formazione a distanza con erogazione di crediti formativi professionali"; (b) realizzare programmi formativi di successo e, allo stesso tempo, minimizzarne i costi di gestione attraverso la formazione blended; (c) favorire e supportare processi di apprendimento formali ed informali, individuali e di gruppo, attraverso gli strumenti del Web 2.0; (d) rendere efficienti i pagamenti dei servizi formativi; (e) condividere informazioni, documenti multimediali e network professionale, ottimizzando la comunicazione e la collaborazione tra gli stakeholder di sistema;" (f) produrre reportistica di supporto alle decisioni in merito alle attività e alle richieste degli iscritti."",";;
"RFB_606,Fondazione Emmanuel - Don Francesco Tarantini Per Le Migrazioni E Il Sud Del Mondo,Soggetto del sistema socio economico regionale,Fondazione,ISIA,LE,Lecce,Servizi innovativi per l'inclusione sociale di cittadini di Paesi terzi: le procedure burocratiche.,""I cittadini di Paesi terzi che si riversano nel nostro paese, danno un forte contributo all'economia e costituiscono la base per il rinnovo generazionale. Una esigenza per chi opera nel settore dell'inclusione sociale è quella di guidare queste persone a districarsi nei meandri burocratici che regolamentano i flussi in ingresso ed in uscita oltre ai diritti e i doveri di chi decide di stabilirsi nel territorio Italiano. Le tecnologie del web 2.0, i sistemi on line interattivi, i Visual Information System, le applicazioni che gestiscono contenuti multimediali, possono dare una risposta concreta a questa problematica. I gate di accesso a tali applicazioni e contenuti potrebbero essere le strutture no-profit che si occupano di integrazione sociale degli immigrati ma potenzialmente potrebbero abilitare nuovo forme di imprenditoria giovanile volta a fornire servizi di formazione/informazione a chi si trova nelle condizioni di orientarsi nella burocrazia Italiana."",";;;;;;;
"RFB_737,Distretto Produttivo Puglia Creativa,Soggetto del sistema socio economico regionale,Distretti Produttivi Regionali,INCR,BA,Bari,Servizi per gli stakeholder pubblici e privati attivi nel settore creativo,""Creazione di una soluzione IT in formato CLOUD che permetta un accesso alle strutture che organizzano eventi di natura artistica e culturale. L'obiettivo è quello di creare un servizio unico che sia di supporto a tutte le realtà pubbliche e private al fine di: promuoverne la conoscenza";" favorirne l'accesso e la fruizione, standardizzare i processi correlati a questi accessi. Dall'altro lato dotare l'amministrazione culturale, laddove necessario di un tool che miri a far conoscere le strutture direttamente ed indirettamente da essa gestite e le modalità in termini contrattuali, economici e normativi connessi ad una loro locazione e/o fruizione da parte di aziende/ ass.culturali etc. Tramite questo tool inoltre l'amministrazione comunale vuole offrire agli enti/aziende gestori degli stessi la possibilità di ampliare tramite soluzioni tecnologiche innovative la fruizione in remote dei servizi offerti all'interno delle strutture."",";;;;;;
"RFB_417, ,Ente Pubblico,Comune,BCUT,LE,Patu',Servizi volti allo sviluppo del turismo: ottimizzazione fruibilità dati di interesse turistico,""Pubblicazione di dati e informazioni su strutture ricettive, località turistiche, eventi e prodotti tipici.";;;;;;;
"Il Comune necessità di un sistema che permetta di creare un solido network di comunicazione nel settore turistico, allo scopo di incentivare il turismo culturale e valorizzare le piccole realtà presenti sul territorio. Rendere fruibili i dati pubblicati sul Web dall'amministrazione comunale e dalle diverse associazioni culturali anche con un semplice smart phone. E' essenziale, inoltre, fornire sistemi (totem, schermi multimediali,...) che possano garantire la circolazione delle informazioni e consolidare il legame Associazioni - Pubblica Amministrazione - Cittadino."",";;;;;;;
"RFB_180,Istituto Tecnico Elenadi Savoia Bari,Ente Pubblico,Altro,ISED,BA,Bari,Servizi Web per le scuole,""Si segnala la necessità di fornire alle scuole di ogni ordine e grado servizi web privi di pubblicità per hosting di siti e attività e learning realmente efficienti per realizzare piattaforme di e learning,  blog di classe, archiovi di materiali iconografici regionali, webquest, siti interattivi e così via.";;;;;;;
La piena disponibilità di tali spazi e le attività formative dovrebbero essere copiosamente implementate e gratuite per docenti e alunni. ;;;;;;;
"Particolare attenzione dovrebbe essere dedicata a forme inmovvative di e learning con il tramite di piattaforme tipo wiki e think tag."",";;;;;;;
"RFB_786,Associazione Nazionale Autonoma Piccoli Imprenditori Della Pesca,Soggetto del sistema socio economico regionale,Associazione,ASTT,BA,Monopoli,Sicurezza in mare: bollettini multimediali delle previsioni del mare,""L'obiettivo è la diffusione della cultura della sicurezza in mare attraverso la disseminazione a larga scala di informazioni relative alle previsioni delle condizioni meteo-marine utilizzando nuove tecnologie e nuovi canali multimediali di distribuzione.";;;;;;;
La sicurezza delle operazioni di pesca in mare dipende fortemente dalla conoscenza delle future condizioni meteo nella zona d'interesse, ma la pianificazione delle attività quotidiane potrebbe essere fortemente migliorata e ottimizzata attraverso la disponibilità di previsioni del mare relative alle zone di potenziale interesse.;;;;;;;
È pero' fondamentale che le previsioni del mare (onde, correnti e temperatura tridimensionali), che risultano nuove e complesse, siano accompagnate da materiale divulgativo e informativo che possa facilmente spiegarle, ampliandone la diffusione. ;;;;;;;
I pescatori sono una realtà produttiva che quotidianamente, a prescindere dalle condizioni meteo-marine, naviga in mare sia di giorno che di notte per svolgere le proprie attività. Le previsioni meteo sono oggi utilizzate in modo consolidato per pianificare le attività di pesca, ma le previsioni del mare (es. onde, correnti, temperatura del mare) oggi tecnicamente disponibili, come lo stato del mare in tre dimensioni, sono ancora poco diffuse, pur essendo essenziali per aumentare la sicurezza della navigazione e delle attività di pesca. ;;;;;;;
Esistono infatti dei limiti nell'accessibilità delle previsioni del mare:;;;;;;;
1) complessità del dato tridimensionale;;;;;;;
2) scarsa conoscenza da parte dell'utenza (es. pescatori) della disponibilità del dato;;;;;;;
3) mancanza di prodotti e servizi di comunicazione multimediali che distribuiscano le previsioni;;;;;;;
4) copertura dei segnali dei comuni mezzi di comunicazione (es. rete telefonica);;;;;;;
Si propone di esplorare la possibilità di distribuire anche previsioni relative alle correnti e alla temperatura dell'acqua in profondità. Queste informazioni tridimensionali saranno di estremo interesse per i pescatori che potranno ottimizzare lo sforzo di pesca evitando di pescare in zone in cui le condizioni (temperature e correnti) in profondità non sono adatte alla presenza di pesce. ;;;;;;;
Si chiede di progettare e testare con gli utenti canali di disseminazione delle previsioni nuovi e di largo consumo (web, tv, cartaceo, internet e community), verificando i formati adatti ai diversi sistemi di comunicazione (es. rete 3g, satellite).;;;;;;;
La piattaforma integrata di comunicazione dovrà includere servizi quali: ;;;;;;;
"1)	bollettino del mare su canale web, televisivo e cartaceo, se necessario";;;;;;;
"2)	prototipo di Totem multimediale da predisporre nei principali porti pugliesi di interesse";;;;;;;
"3)	materiale e schede informative che mettano a disposizione degli utenti le informazioni necessarie a capire ed interpretare le previsioni";;;;;;;
"4)	sistema di raccolta dei feedback da parte dei pescatori sui servizi e sulla qualità delle previsioni"",RFB_785";;;;;;;
"RFB_458, ,Ente Pubblico,Comune,TRMO,BA,Polignano A Mare,SICUREZZA PER GLI ATTRAVERSAMENTI PEDONALI,""Nel contesto urbano del comune di Polignano riconosciamo alcune strade per le quali vorremmo migliorare la sicurezza dei pedoni nell'atto di attraversarle con particolare riferimento alle fasce orarie in cui il grado di illuminazione risulta scarso.";;;;;;;
Dato il grande flusso di traffico e di popolazione che circola a piedi nella nostra cittadina, anche per via di un notevole flusso turistico, vorremmo poterci dotare di un sistema capace di far fronte a questo bisogno e garantire quindi una maggiore tutela delle persone.;;;;;;;
",
RFB_422, ,Ente Pubblico,Comune,TRMO,LE,Patu',sicurezza stradale,Nonostante le piccole dimensioni, il comune di Patù è attraversato da tratti interni di strade provinciali, essenziali per la rete di viabilità del bassosalento. Per migliorare la viabilità e la sicurezza, il comune avrebbe bisogno di un sistema di controllo del traffico lungo queste arterie di importante traffico (video sorveglianza per il controllo delle infrazioni e sistemi di segnalazione in caso di forti velocità)."",";;;;;;;
"RFB_757,Consiglio Nazionale Delle Ricerche - Istituto Per Le Tecnologie Della Costruzione,Soggetto del sistema socio economico regionale,Altro,BCUT,BA,Bari,Sistema autore per implementare enciclopedie on-line aperta con produzione di e-book,""E' sempre più importante, sopratutto per le numerose istituzioni culturali pugliesi di piccole dimensioni, caratterizzate da ridotte risorse tecnico-economiche, disporre a costi contenuti di strumenti tecnologici semplici da utilizzare  per condividere il proprio patrimonio di conoscenze - spesso poco o affatto valorizzato -  con un pubblico sempre più ampio e propenso all'impiego di tecnologie multimediali anche su dispositivi mobile.";;;;;;;
Si rende pertanto necessario implementare un sistema autore (con software open source da utilizzare con un browser) in grado di implementare - con procedure assistite - un sistema informativo integrato che permetta al pubblico una fruizione virtuale di siti (di valenza storico-architettonica-archeologica) e reperti.;;;;;;;
In particolare il sistema autore dovrà prevedere la creazione di una enciclopedia on-line, aperto al contributo (filtrato) dei social networks, con la possibilità di produrre e-book multimediali consultabili mediante specifiche app su smartphone e tablet.;;;;;;;
Tale sistema andrà ad integrare i tool disponibili in ITC-CNR e relativi all'implementazione di mappe interattive e tour virtuali.;;;;;;;
Il sistema andrà testato su una specifica area di studio, preferibilmente riconducibile alla Daunia garganica.;;;;;;;
",
RFB_464, ,Ente Pubblico,Comune,GEPA,BA,Conversano,SISTEMA CENTRALIZZATO DI ALERT,Nell'ottica di ottimizzare le risorse pubbliche sorge per noi l'esigenza di dotarci di un sistema centralizzato capace di ricevere informazioni da vari ambiti ed immobili comunali, in merito ad eventi generici che possono generare un danno della cosa pubblica e gestire gli alert direttamente presso l'unico ufficio manutenzioni per un pronto intervento.";;;;;;;
