CODICE,DENOMINAZIONE_RICHIEDENTE,CATEGORIA,TIPOLOGIA,DOMINIO_RIF,PROVINCIA_SEDE,COMUNE_SEDE,TITOLO,MANIFESTAZIONE_INTERESSE,CODICI_EQUIVALENTI;;;;;;;
"RFB_82,Calasanzio - Cultura E Formazione,Soggetto del sistema socio economico regionale,Associazione,ISIA,LE,Campi Salentina,""""""CALASANZIO IN RETE"""""",""ll progetto si propone una diffusione, a livello nazionale, degli strumenti per coniugare i fabbisogni di competenze di un'organizzazione o di un territorio con una appropriata formazione in tutte le fasi (programmazione, realizzazione, gestione e valutazione), rivolta ad adulti di diversa estrazione sociale. Il luogo di lavoro ed il fulcro di svolgimento delle attività sarà la Biblioteca Calasanziana.";;;;;;;
;;;;;;;
Il progetto prevede tre livelli di trasferimento delle competenze:;;;;;;;
;;;;;;;
1. Conoscenze e competenze di base sulla formazione, tramite la realizzazione di un prodotto multimediale da diffondere all'intero target del progetto;;;;;;;
2. Approfondimento delle competenze sulla formazione tramite il coinvolgimento in sessioni di action learning (LIFE LONG LEARNING PROGRAMME);;;;;;;
3. Affiancamento da parte di consulenti per la applicazione a casi reali sia delle conoscenze e competenze acquisite sia degli strumenti forniti dalla Biblioteca Multimediale.;;;;;;;
;;;;;;;
Biblioteca e multimedialità:;;;;;;;
;;;;;;;
La multimedialità offre la possibilità di capire le potenzialità delle intelligenze degli adulti e promuove l'integrazione. ;;;;;;;
Poiché essa si costruisce sull'articolazione di una molteplicità di codici e linguaggi (parola, scrittura, suono, immagine), meglio si adatta a rispondere a soggetti che hanno necessità di diversificazione e personalizzazione dell'intervento di rete ed in rete. ;;;;;;;
;;;;;;;
La telematica assume un ruolo rilevante per l'individuazione degli argomenti, nel dare ai potenziali beneficiari molti modi di padroneggiare il materiale. ;;;;;;;
;;;;;;;
Lavorare insieme nel laboratorio, offre la possibilità di praticare la relazione insegnante / allievo, secondo un modello didattico relazionale / collaborativo e non unidirezionale / trasmissivo;" la pratica del laboratorio favorisce le strategie dell'""""imparare insieme"""", centrate sulla costruzione a più mani di un elaborato multimediale (ipertesti)"; propone una strategia basata sull'assunzione, a turno, di ruoli di protagonismo da parte dei diversi componenti del gruppo di apprendimento. ;;;;;
;;;;;;;
L'azione della guida si concretizza nel progettare, allestire e far funzionare un impianto didattico basato sul protagonismo di coloro che devono e vogliono sperimentare, apprendere e accrescere i proprio bagaglio culturale e/o nozionistico.;;;;;;;
;;;;;;;
Ambiti aree disciplinari:;;;;;;;
- Storia dell'arte;;;;;;;
#NOME?;;;;;;;
#NOME?;;;;;;;
"- Lettere e storia patria."",";;;;;;;
"RFB_823,Consorzio Asi - Brindisi,Ente Pubblico,Altro,INCR,BR,Brindisi,""""""Centro servizi territoriale per il monitoraggio e l'interscambio informativo delle opportunità esis"",""Sviluppare un sistema telematico, eventualmente integrabile con uno sportello informativo, focalizzato sul costante censimento ed aggiornamento sia delle attività operanti che dei prodotti realizzati ed utilizzati all'interno delle aree industriali ricadenti sotto la competenza del Consorzio ASI di Brindisi. ";;;;;;;
Ciò al fine di agevolare le opportunità di collaborazione tra PMI con la creazione, il consolidamento e/o il completamento di filiere produttive e di servizi per l'ottimizzazione di prodotto e/o di processo. Il monitoraggio consente anche di evidenziare necessità specifiche, non ancora soddisfatte, utili ad effettuare ricerche mirate per l'attrazione di nuovi soggetti imprenditoriali nell'area industriale di Brindisi in grado di colmare le eventuali lacune riscontrate.;;;;;;;
",
RFB_280, ,Ente Pubblico,Comune,BCUT,FG,Alberona,""CULTU-RISMO"""""",""incrementare il sistema turistico/commerciale del territorio attraverso la promozione nei giovani della cultura imprenditoriale in tema di turismo, arte e food.";;;;;;;
"dotazione e/o istallazione presso gli operatori locali di attrezzature tecnologiche (info point) e conseguente messa in rete tra gli stessi con tour operetor per la promozione e pubblicizzazione del patrimonio archeologico-culturale -storico nonchè enogastronomico del territorio dei Monti Dauni."",";;;;;;;
"RFB_59,Porta D'Oriente - Associazione Culturale E Di Volontariato,Soggetto del sistema socio economico regionale,Associazione,BCUT,LE,Tricase,A.C.A.I.T. Museo Virtuale,""Il progetto vuole restituire e far condividere a tutta la collettività, locale e non, la memoria e la fruizione del patrimonio materiale ed immateriale dell'A.C.A.I.T. di Tricase, attraverso la creazione di un Museo Virtuale Online che ne riproduca il suo immenso valore storico, culturale ed economico. A tal fine si propone una strategia di intervento che si basa su due azioni fondamentali: ";;;;;;;
1) un'attività di Ricerca bibliografica, documentale e sul campo, tale da: ;;;;;;;
"-	recuperare, inventariare e rendere disponibile il patrimonio archivistico ' librario sull'A.C.A.I.T.";;;;;;;
"-	indagare, censire e pubblicare gli aspetti antropologici e materiali della classe operaia dell'epoca";;;;;;;
2) un'attività di Sviluppo Tecnologico, finalizzata a:;;;;;;;
"-	ricostruire in un modello 3d gli ambienti lavorativi e i beni materiali dell'edificio";;;;;;;
"-	conservare in formato digitale il materiale documentale, librario e fotografico già presente nel suo Archivio Storico e quello che risulterà disponibile dall'attività di Ricerca";;;;;;;
"-	consentire al pubblico degli utenti la navigazione multimediale ed interattiva tra i suoi contenuti storici e culturali.  ";;;;;;;
Da qui la consapevolezza della possibilità concreta di trasformare un contenitore di risorse non accessibili in risorsa culturale ed economica dal quale il territorio possa trarre benefici in termini di immagine e di promozione turistico - culturale.;;;;;;;
Obiettivo generale e target. L'obiettivo generale del progetto si può pertanto enunciare in:;;;;;;;
&#61656;"	salvaguardare la memoria storica, la cultura, il patrimonio materiale ed immateriale dell'A.C.A.I.T. di Tricase e al contempo promuovere la città e il territorio del Capo di Leuca sul piano turistico e culturale.";;;;;;
La declinazione di tale obiettivo rispetto ai bisogni dei destinatari a cui si rivolge si articola nei seguenti obiettivi intermedi: ;;;;;;;
"'	rispetto alla comunità locale, il progetto mira a diffondere la conoscenza delle testimonianze storiche e antropologiche legate alla lavorazione del tabacco, quale occasione di crescita culturale, consapevolezza delle proprie radici storiche, sensibilità verso la tutela del patrimonio di 'valore' racchiuso nei propri luoghi"; ;;;;;;
"'	rispetto alle istituzioni locali, il progetto si propone di promuovere il loro concreto impegno nel migliorare le condizioni di fruibilità e conoscenza del patrimonio storico, antropologico e sociale considerato dal progetto, sia migliorandone l'accessibilità sul piano infrastrutturale, sia partecipando all'iniziativa di promozione messa in campo dal 'marchio territoriale collettivo' proposto dal progetto";;;;;;;
"'	rispetto ai turisti-visitatori non locali, il progetto mira a soddisfare il desiderio di conoscenza e approfondimento sulle radici della civiltà salentina, che può riguardare visitatori esperti (ricercatori, studiosi), cultori e appassionati, studenti, potendo in tal modo proporre il servizio alle relative organizzazioni di appartenenza (centri di ricerca, istituzioni formative, associazioni culturali)"; ;;;;;;
",
RFB_53,Stradegiovani A.P.S.,Soggetto del sistema socio economico regionale,Associazione,ISIA,LE,Lecce,Accessibilità dei Beni Culturali,La fruizione dei beni culturali alle persone con disabilità sensoriali (non vedenti e non udenti) si pone con particolare rilievo nel nostro territorio ricco e denso di bellezze architettoniche e paesaggistiche. ";;;;;;;
Tale diritto, che è anche riconosciuto dall'art. 3° della Convenzione Internazionale dei Diritti delle persone con disabilità (ratificata in Italia dalla legge n. 19 del 2009), può facilmente essere soddisfatto dall'impiego delle tecnologie dell'informazione e comunicazione.;;;;;;;
La descrizione di monumenti, la descrizione delle opere contenute nei musei e nelle gallerie d'arte, la descrizione dei parchi naturali può essere 'ascoltata' da un non vedente e 'letta' da un non udente.;;;;;;;
Si potrebbe quindi prevedere, per ogni bene culturale di rilievo del territorio, per ogni museo e galleria d'arte, per ogni parco naturale un sistema di audio guide su tablet  che contenga una descrizione scritta per i non udenti e una descrizione audio per i non vedenti. ;;;;;;;
Va sottolineato che la descrizione per i non vedenti deve essere fatta da personale specializzato che sa come descrivere qualcosa a chi non è in grado di vederla (dare dimensioni di riferimento, colori, forme).;;;;;;;
L'ampia diffusione di questi supporti costituirebbe una vera occasione di integrazione in quanto la persona con disabilità non sarebbe più costretta a scegliere cosa visitare in base all'accessibilità, ma potrebbe per la prima scegliere in base al proprio interesse.;;;;;;;
;;;;;;;
",
RFB_52,Stradegiovani A.P.S.,Soggetto del sistema socio economico regionale,Associazione,ISIA,LE,Lecce,Accessibilità del Web,Il tema dell'accessibilità del web alle persone con disabilità si pone con forza nel contesto sociale e lavorativo attuale in cui molte informazioni e relazioni passano attraverso la rete e le tecnologie. ";;;;;;;
L'inclusione sociale delle persone con disabilità si realizza mettendo al centro la persona con disabilità e riconoscendo il suo diritto all'istruzione, al lavoro, alla cura, alla fruizione della cultura, alle relazioni sociali, alla mobilità, ecc., ma si realizza anche attraverso il pieno accesso al web sia come fonte di informazione, ad esempio per chi ha ridotta mobilità, sia come occasione di attività lavorativa, che come facilitazione relazionale se pensiamo al mondo de social network.;;;;;;;
La legislazione italiana (Legge n. 4 del 9 gennaio 2004) prevede, almeno per la pubblica amministrazione,  il diritto di accesso per tutti ai servizi informatici e telematici della pubblica amministrazione e ai servizi di pubblica utilità.  Purtroppo non sempre all'emanazione di una legge segue la sua concreta applicazione.;;;;;;;
Per questo si manifesta l'esigenza di costruire siti accessibili alle diverse disabilità, di avviare un monitoraggio dei siti già esistenti per verificare i requisiti di accessibilità previsti dalla legge, di diffondere l'utilizzo di tecnologie assistive tra gli strati più ampi delle persone con disabilità.  ;;;;;;;
In questo modo si possono ridurre alcuni degli svantaggi delle persone con disabilità e realizzare l'uguaglianza prevista dalla nostra Costituzione. ;;;;;;;
L'Associazione mette a disposizione del territorio le competenze acquisite nel percorso di formazione di Tecnoabilitiamoci, per formare sull'accessibilità al web personale di aziende, pubbliche amministrazioni, istituti scolastici, enti e monitorare l'accessibilità dei siti già esistenti.;;;;;;;
",
RFB_345, ,Ente Pubblico,Comune,ASTT,LE,Lecce,Accessibilità e Decoro Urbano,In relazione al dominio di riferimento, si evidenziano alcune problematiche che incidono negativamente sul decoro urbano, sull'accessibilità e sulla qualità della vita in generale. Nello specifico, ed a scopo meramente esemplificativo, ci si riferisce a:";;;;;;;
' Affissioni abusive: locandine, manifesti affissi ovunque su edifici pubblici, palazzi storici, etc.;;;;;;;
' Atti di vandalismo a beni pubblici e privati.;;;;;;;
' Randagismo. In Puglia sono più di 70 mila i randagi che girano tra città e campagne. Le cattive condizioni di vita di questi animali (mancanza di cibo, di acqua, ') possono provocare aggressioni a volte anche fatali.;;;;;;;
"' Barriere architettoniche. L'eliminazione delle barriere architettoniche è un diritto del cittadino sancito dalla Costituzione(legge del 1989). Eppure in Italia sono tre milioni i cittadini che praticamente """"reclusi"""" a causa della presenza di barriere architettoniche. Circa il 20% delle popolazione della Unione Europea, secondo una ricerca realizzata dalla stessa Unione, è investita in modo più o meno diretto dalla limitazione derivante dalla presenza di barriere. In questa analisi si fa riferimento oltre che alle persone con handicap fisici permanenti, anche ad anziani con difficoltà deambulatoria, persone obese e, perfino, genitori con i passeggini.";;;;;;;
Si ritiene che le predette problematiche possano trovare adeguata soluzione attraverso lo sviluppo di un'applicazione mobile mirata in grado di incentivare la cittadinanza a partecipare allo sviluppo e tutela del territorio urbano. Uno strumento gratuito per il cittadino, rappresentato da un sito web ed un'applicazione mobile, per la segnalazione di disagi, eventi e possibili situazione di degrado urbano in relazione a:;;;;;;;
' rifiuti abbandonati o non raccolti; ;;;;;;
' dissesto stradale;;;;;;;
' aree verdi attrezzate come parchi, giardini, prati, aree attrezzate per i bambini ;;;;;;;
' atti di vandalismo; segnaletica stradale;;;;;;
' affissioni abusive;;;;;;;
' randagismo;;;;;;;
' presenza di barriere architettoniche;;;;;;;
' inquinamento acustico.;;;;;;;
"Tutte le segnalazioni verrebbero pubblicate su una mappa all'interno di un'apposita interfaccia di amministrazione, consentendo agli operatori di monitorare costantemente il territorio ed intervenire al meglio per la risoluzione dei problemi, ed al cittadino attivo di venire a conoscenza della risoluzione dei problemi segnalati."",";;;;;;;
"RFB_661,""Centro Interuniversitario Ricerche Sulla Complessità,Sezione Università Di Foggia"",Ente Pubblico,Altro,INCR,FG,Foggia,Accessibilità eredità culturale con tecniche digitali e via internet,E' nostro interesse nell'ambito della storia della scienza la valorizzazione attraverso tecniche digitali del patrimonio culturale ( museale e non) e la sua diffusione attraverso internet e social media. In particolare siamo interessati alla creazione di musei on line e di una circostanziata documentazione su raccolte di interesse scientifico e naturalistiche.,";;;;;;;
"RFB_542,Consorzio Di Bonificamontana Del Gargano,Ente Pubblico,Altro,ASTT,FG,Foggia,Acquedotti rurali del Gargano,""Il Consorzio ha recentemente completato (si prevede l'avvio dell'esercizio entro il corrente mese di ottobre) la realizzazione del I Lotto degli Acquedotti rurali del Gargano - schema sud, opera che sii sviluppa, complessivamente, su circa 70 Km. di condotte che attraversano i territori di Apricena, Rignano Garganico, San Marco in Lamis e San Giovanni Rotondo.";;;;;;;
"L 'impianto è dotato di n. l O rilevatori di flusso, per mezzo dei quali, unitamente ai rilevamenti disponibili ai serbatoi e ai contatori, è possibile valutare, anche se non in tempo reale, l'esistenza di eventuali """"perdite"""".";;;;;;;
Risulta di particolare interesse per l 'Ente avere la disponibilità di un sistema di più tempestiva;;;;;;;
"acquisizione di """"perdite"""" lungo il tracciato, con individuazione sufficientemente puntuale dell'area interessata.";;;;;;;
",
RFB_796, ,Ente Pubblico,Comune,ASTT,BR,Brindisi,Acquisizione di una suite di applicazioni (apps) per smartphones e sito web per comunicazione integr,La necessità da parte della pubblica amministrazione è di promuovere il proprio territorio";;;;;;;
con importanti ed evidenti ricadute sulla vita turistica della cittá e, dall'altra parte, la necessitá di studiare azioni mirate alla gestione veloce di temi così attuali come la raccolta differenziata dei rifiuti che permetta al cittadino di segnalate tempestivamente, con l'aiuto della fotocamera dello smartphone, oggetti che richiedono un intervento di igiene urbana. ;;;;;;;
L'app (o sistema) potrebbe anche contenere un manuale con l'elenco di oggetti di uso comune con l'indicazione del corretto smaltimento per il successivo riciclo. ;;;;;;;
I cittadini in tal modo, possono essere stimolati ad un un processo di cittadinanza attiva e consapevole e l'amm.ne comunale promuove la propria immagine virtuosa.;;;;;;;
Fondamentale sarebbe il coinvolgimento della Polizia Municipale quale organo di controllo.;;;;;;;
",
RFB_354, ,Ente Pubblico,Comune,ISIA,LE,Lecce,Active People,Si propone la realizzazione di un portale 'Active People' capace di mettere in collegamento chi cerca micro-lavori e chi li offre. Si pensa ad esempio a studenti universitari e/o di scuola superiore, ma anche soggetti  'anziani', che mettono a disposizione il proprio tempo libero e le proprie competenze ed abilità per:";;;;;;;
"-  servizi verso la terza età, anche per brevi lassi di tempo, pomeriggio o serata, quali servizi di """"fammi la spesa"""" (passare da casa, ritirare la lista, e fare la spesa portando lo scontrino)";;;;;;;
"-  servizi di babysitting e/o servizi di """"doposcuola""""";;;;;;;
#NOME?;;;;;;;
- servizi di 'cucino per te'.;;;;;;;
"Dovrà garantirsi l'identificazione della prestazione mediante il tracciamento di chi lavora per chi. Ogni utente che si registra per """"offrire"""" lavoro sarà obbligatoriamente identificato fisicamente presso gli uffici convenzionati (comune, segreteria studenti, officine Cantelmo, ecc..). E' previsto un meccanismo di feedback per valutare sia chi offre che chi compra i servizi.";;;;;;;
"Active People funziona da hub per il pagamento delle prestazioni: chi compra paga ad ActivePeople (in anticipo), chi esegue la prestazione riceve una ricevuta consuntiva di tutte le prestazioni effettate a fine mese (se somma > 0) riportando nella legalità quei lavoretti che sarebbero altrimenti """"a nero""""."",";;;;;;;
"RFB_182,Its Elena Di Savoia,Ente Pubblico,Altro,ISED,BA,Bari,Adolescenza dispersa,""Si segnala la necessità di creare luoghi di monitoraggio della dispersione scolastica a livello di comune e province con dati incrociati con le scuole e e gli uffici scolastici territoriali. I dati devono poter essere accessibili alle scuole ma devono anche permettere la costruzione di una profilatura individuale degli alunni che si disperdono, almeno fino ai 16 anni.";;;;;;;
"Non basta infatti la cosiddetta """"anagrafe scolastica"""" attuale per venire a capo di questo problema.";;;;;;;
Il monitoraggio deve poter successivamente permettere di intervenire sulle cause della dispersione alunno per alunno con task force formative efficaci e dedicate. ;;;;;;;
"L'uso di dati trattati con dinamicità può permettere interventi conoscitivi reali (non solo quantitativi) risolutori e tempestivi."",";;;;;;;
"RFB_374,Agis - Associazione Generale Italiana Spettacolo,Soggetto del sistema socio economico regionale,Sindacato,INCR,BA,Bari,Agiscuola,""Il dialogo fra scuola e mondo della cultura e dello spettacolo è un dialogo che in Puglia si affida molto alla sensibilità dei docenti e all'iniziativa di quegli operatori ' del teatro e del cinema ' che hanno a cuore la formazione di quel pubblico che proprio nella scuola ha casa. Manca oggettivamente una messa a sistema complessiva che faciliti a livello regionale la trasmissione delle informazioni e soprattutto l'organizzazione strutturata delle uscite o dei momenti di formazione dei più giovani. In questo scenario sicuramente ci sono felici eccezioni, legate soprattutto al teatro ragazzi, ma si tratta ancora di mosche bianche che non possono compensare l'oggettiva assenza di impianto. Un primo passo verso la formalizzazione di un sistema, sarebbe quindi la creazione di un portale totalmente dedicato al mondo della scuola e alle proposte che tanto il cinema quanto il teatro, la danza e la musica gli dedicano.";;;;;;;
Un sistema giovane dove oltre ai calendari, agli appuntamenti e agli incontri, siano caricati tutti quei contenuti extra (video, interviste, trailer, approfondimenti) fondamentali per attrarre i più giovani e i loro insegnanti. Un sistema che consenta ai docenti di prenotare anche soltanto on line e con un motore di ricerca che consenta di individuare, per temi, le proposte più congeniali alle esigenze specifiche della scuola. Il portale si configurerebbe anche come carta d'identità delle varie strutture attive con le scuole, una carta d'identità dove caricare il curriculum di ogni soggetto che propone attività o azioni per i ragazzi, ma anche vario di contenuti e di modelli di intervento da offrire alle scuole. È fondamentale, per tutelare la stessa scuola dal dilettantismo comunque molto diffuso, proporre alla scuola un'offerta che sia di qualità e la cui qualità possa essere 'pesata' proprio a partire da tutte le informazioni e gli approfondimenti contenuti sul portale.;;;;;;;
",
RFB_249, ,Ente Pubblico,Comune,ISIA,BA,Capurso,Alfabetizzazione Informatica a favore dell'inclusione sociale e invecchiamento attivo e in salute,Attività importante per il nostro territorio che vede la presenza di 4 Case di Cura per Anziani, un Centro Sociale per Anziani gestito dal Comune di Capurso, molte attività inclusive di carattere sociale come";;;;;;;
"servizio civico e cooperative sociali, collaborazione con l'Università della Terza e Libera Età in  progetti Europei con Tecnopolis Owle 50+ Lifelong learning programme."",";;;;;;;
"RFB_276, ,Ente Pubblico,Comune,ASTT,FG,Pietramontecorvino,Ambiente Sano,""Monitoraggio telematico delle aree di interesse ambientale  finalizzato a produrre  rapporti periodici sulle qualità  dell'aria, delle acque, e lo stato dell'ambiente in generale. In particolare nelle aree a rischio di incendio sarebbe opportuno installare dei  sensori di calore per prevenire incendi nei periodi più caldi."",";;;;;;;
"RFB_716,Distretto Agroalimentare Di Qualità Jonico Salentina S.C. A R.L.,Soggetto del sistema socio economico regionale,Distretti Produttivi Regionali,INCR,LE,Lecce,Ambienti innovativi per la promozione di percorsi enogastronomici,""Il Distretto Agroalimentare di Qualità Jonico Salentino (DAJS), operante nell'ambito territoriale delle province di Taranto, Lecce e Brindisi, raggruppa ad oggi 187 imprese, tra cui PMI, enti e associazioni pubbliche e private, Centri di Ricerca e Università. Obiettivo primario del distretto è quello di consolidare e rafforzare l'aggregazione e il confronto dei diversi interessi locali, al fine di offrire alle PMI del comparto agroalimentare, gli strumenti necessari ad: accrescere competitività e capacità innovativa, ampliare la presenza nei mercati esteri, intensificare processi di crescita dimensionale e favorire lo sviluppo di nuova imprenditorialità. In tale ottica il DAJS intende intraprendere un progetto volto alla valorizzazione del tessuto turistico locale attraverso la creazione di un network di percorsi enogastronomici con cui promuovere in Italia e nel Mondo il territorio Salentino e i suoi prodotti. Tale progetto intende creare un ambiente innovativo in cui sposare tecnologia e tradizione in una nuova visione di viaggio sensoriale che porti il turista a conoscere il Salento attraverso il gusto e gli altri sensi. Attraverso l'utilizzo di strumenti informativi si vuole creare un fil rouge di emozioni, sapori e sensazioni ripetibili nel tempo attraverso l'acquisto dei prodotti degustati. Tale ambiente, se da un lato è volto a promuovere il turismo 365 giorni l'anno, dall'altro dovrà rappresentare elemento di attrattività anche per altre PMI operanti nel settore agroalimentare, ma non appartenenti al DAJS, che attraverso tale network possono trovare supporto al raggiungimento di livelli di qualità certificata e accedere, in maniera semplice, ad una soluzione in grado di commercializzare e promuovere i propri prodotti a livello internazionale."",";;;;;;;
"RFB_634,Aperta-Mente,Soggetto del sistema socio economico regionale,Associazione,ISIA,LE,Lecce,APERTA MENTE,""In una società complessa, globalizzata e soggetta a rapidi mutamenti come quella attuale, il 'Cittadino' avverte sempre più l'esigenza di nuovi strumenti utili ad individuare e facilitare la soddisfazione di bisogni vecchi e nuovi.";;;;;;;
Partendo da questa esigenza generale di fondo, il progetto APERTA MENTE  assume un senso: proporsi come piattaforma interattiva attraverso la quale la domanda e l'offerta relative a bisogni primari di 'cura e benessere' della persona possano incrociarsi trovando, in tempi molto più rapidi rispetto ai sistemi tradizionali di ricerca, una vasta gamma di soluzioni e proposte ispirate a logiche curative e terapeutiche diverse nell'ottica del più ampio pluralismo possibile, tale da favorire scelte libere e consapevoli.;;;;;;;
L'interattività del portale  consentirà ai cittadini non solo di usufruire delle informazioni relative ai diversi servizi di cura alla persona esistenti sul territorio nazionale, ma anche di contribuire ad arricchire l'offerta  di proposte che non siano già parte integrante della banca dati disponibile.;;;;;;;
E' evidente, quindi, che il potenziale del living-lab è molto elevato poiché dispone di svariati meccanismi di crescita, arricchimento e progressivo adattamento ad una  realtà che, come si è già detto, richiede notevole elasticità dati i rapidi mutamenti cui è soggetta.;;;;;;;
Ulteriore punto di forza del progetto è l'attitudine ad essere veicolo di un rapporto diretto di scambio tra cittadino che esprime un bisogno ed ente o singolo professionista che può essere in grado di soddisfarlo, in modo da instaurare relazioni di cura più profonde con cognizione di causa, avendo già un saggio delle competenze dell'interlocutore.;;;;;;;
Per quanto sopra esposto si ritiene che il progetto in questione sia uno strumento utile ed efficace ai fini di facilitare la cura ed il benessere dei cittadini.;;;;;;;
