CODICE,DENOMINAZIONE_RICHIEDENTE,CATEGORIA,TIPOLOGIA,DOMINIO_RIF,PROVINCIA_SEDE,COMUNE_SEDE,TITOLO,MANIFESTAZIONE_INTERESSE,CODICI_EQUIVALENTI;;;;;;;
"RFB_477,""Associazione """"Ampiamente"""""",Soggetto del sistema socio economico regionale,Associazione,ISED,LE,Salve,Formazione degli associati/formatori,""L'associazione """"Ampiamente"""" intende promuovere, sostenere e sviluppare una formazione e un aggiornamento qualificata per i suoi associati. Per queste ragioni è interessata a sviluppare le competenze riguardo l'utilizzo di metodologie didattiche attive/espressive per i suoi associati, l'utilizzo delle Ict nei processi di formazione, l'e-learning e l'e-learning avanzato e l'acquisizione dei modelli teorico-pratici dell'out-door per la formazione. Inoltre, avendo come statuto espresso l'interesse per incentivare la riflessione sulle prassi formative al fine di maturare prospettive teoriche e metodologiche più avanzate e condivise, gli associati di """"Ampiamente"""" esprimono il fabbisogno di essere formati riguardo il tema della """"progettazione dell'intervento formativo"""" e sul """"monitoraggio e valutazione degli interventi e dei processi formativi""""";;;;;;;
;;;;;;;
",
RFB_197,Tecnopolis Parco Scientifico E Tecnologico,Soggetto del sistema socio economico regionale,Altro,ISIA,BA,Valenzano,Formazione donne over 50,A fronte dei trend e della recente legislazione, gli ultracinquantenni, in particolar modo le donne, sono ancora pesantemente svantaggiati nel mercato europeo del lavoro. E' preoccupante: il numero delle over 50 è in crescita, ma molte di esse non possiedono le competenze per gestire i cambiamenti e difficilmente si impegnerebbero in percorsi di formazione se non fortemente incoraggiate e motivate"; inoltre molte di loro hanno un disperato bisogno di entrate extra. In ogni paese Europeo, questa situazione è stata per lo più ignorata ma, per urgenti motivazioni socio-economiche, è necessario sviluppare in tempi brevi delle modalità per aiutare un gran numero di ultracinquantenni ad invecchiare positivamente. Tecnopolis ha sviluppato con altri due partner una metodologia di intervento e l'ha sperimentata nel progetto OWLE50+, sostenuto dalla UE, ed ha dimostrato che prendere parte ad azioni di questo tipo ha trasformato concretamente la vita delle donne. L'esperienza andrebbe riprodotta su numeri significativi, e magari personalizzata anche agli uomini da reinserire sul mercato del lavoro, mettendo tutti in grado di porsi degli obiettivi, di realizzare le proprie  potenzialità, continuare a contribuire alla società ed invecchiare positivamente. ;;;;;;
"Le tecnologie TIC, e in particolare la familiarità che si riesce a indurre negli over 50 con le stesse, sono un importante risultato contro l'esclusione, il digital divide e la povertà. Le stesse tecnologie sono il principale motore operativo della fornitura di opportunità di informazione, formazione e accompagnamento al lavoro in proprio alla base della metodologia."",";;;;;;;
"RFB_70,Percorsi Meridiani,Soggetto del sistema socio economico regionale,Associazione,BCUT,LE,San Cesario Di Lecce,Fruibilità ed accessibilità dei Beni Culturali 'nascosti' e percorsi culturali multicanale,""L'interesse all'uso di nuove Tecnologie dell'Informazione e della Comunicazione in ambito Turistico e dei Beni Culturali nasce dalla crescente necessità di valorizzare le innumerevoli risorse del nostro territorio e renderle accessibili alle diverse tipologie di turisti ed attori (dal turista culturale, allo studente, al cittadino, all'impresa). ";;;;;;;
Un'esigenza particolare è quella di riportare alla luce e rendere accessibile l'enorme tesoro 'nascoto' del nostro territorio (la Lecce sotterranea per far un esempio su tutti). Grazie alle nuove tecnologie (Realtà Virtuale e Realtà Aumentata) è possibile rendere fruibile tutto il patrimonio nascosto o il patrimonio che fu delle civiltà che ci hanno preceduto e renderlo accessibile con differenti tipi di dispositivi (dai totem virtuali ai dispositivi mobili) a differenti tipi di utenze. ;;;;;;;
"Il turista inoltre attualmente non ha a disposizione un'assistenza adeguata sul territorio. In piccoli paesi come San Cesario di Lecce, ricchi di tesori, non esiste una infrastruttura economico-tecnologica che riesca a valorizzarli, c'è la necessità di avere strumenti che accompagnino il turista lungo tutto il suo viaggio ed in questo le TIC e le nuove tecnologie potrebbero fornire un valido supporto."",RFB_88";;;;;;;
"RFB_419, ,Ente Pubblico,Comune,BCUT,LE,Patu',fruizione dei beni museali,""Il comune di Patù riscontra le seguenti necessità: ";;;;;;;
- sviluppo di un sistema di fruizione dei Beni Museali e degli spazi culturali, attraverso tecnologie PDA e smartphone (audio guide e contenuti culturali);;;;;;;
#NOME?;;;;;;;
"- rendere visitabile, attraverso un tour virtuale, il museo e i monumenti storico-culturali attravero il Web."",";;;;;;;
"RFB_599, ,Ente Pubblico,Comune,BCUT,LE,Cavallino,Galleria del Palazzo Ducale di Cavallino - Ricostruzione tridimensionale e rappresentazione virtuale,""Il Comune di Cavallino ha tra i suoi obiettivi la salvaguardia, conservazione, valorizzazione e fruizione dei Beni Culturali e Ambientali del proprio territorio, mediante l'utilizzo di strumenti informatici e tecnologici innovativi"; la promozione del patrimonio artistico, culturale ed economico del territorio, la ricerca e innovazione tecnologica, la divulgazione della conoscenza.;;;;;;
In particolare, il Comune intende realizzare, tra l'altro, in collaborazione con il Laboratorio 3D Lab 'CASPUR-Città di Otranto', il progetto di  acquisizione digitale, ricostruzione tridimensionale e rappresentazione virtuale della Galleria del Palazzo Ducale, una magnifica sala ricevimenti riccamente decorata del Castello Ducale Castromediano-Limburg che fu dimora dell'illustre duca Sigismondo Castromediano, allo stato attuale piuttosto decadente, a causa dell'incuria del tempo e di improprie destinazioni d'uso, ma classificata come bene di altissima rilevanza culturale e artistica.;;;;;;;
",RFB_580
RFB_352, ,Ente Pubblico,Comune,GEPA,LE,Lecce,Gateway Pagamenti Multicanale,L'esigenza dell'Ente consiste nello sviluppo e nell'integrazione, all'interno di una più ampia piattaforma di eGov, di una componente per la gestione delle procedure di riscossione delle entrate sia di natura tributaria sia di natura extra-tributaria (quali ad esempio i servizi a tariffa, i canoni di locazione, ecc.). Consentirebbe all'Ente di disporre di un unico strumento condiviso e generalizzato per la gestione dell'intero processo di carico, emissione provvedimenti e registrazione dei pagamenti, attraverso logiche e meccanismi che permettono di relazionare e mantenere sotto controllo i vari flussi informativi provenienti dai diversi sistemi interni all'Ente, i gateway e i canali di pagamento esterni, i servizi integrati nei Portali per il Cittadino e altri sistemi esterni all'Ente (ad esempio per il ruolo coattivo). All'interno di un'unica banca dati sarebbero disponibili i dettagli di tutte le possibili entrate dell'Ente e i dati del processo di riscossione in una visione centrata sul singolo contribuente con la definizione di 'documento di pagamento' che, astraendosi dalle peculiarità della singola tipologia di entrata, permette l'identificazione di ciascuna 'voce di debito' (sistema competente del credito, soggetto debitore, tipo di entrata, scadenza e relativa entità del pagamento, canale di riscossione, ecc.), nonché la completa gestione e tracciatura del ciclo di vita (iter) del documento stesso. Tale piattaforma consentirebbe, inoltre, l'erogazione di un servizio di sportello fiscale per i cittadini e le imprese con informazioni certificate ed aggiornate dei crediti vantati dall'Ente. ";;;;;;;
"Il sistema dei pagamenti realizzerebbe un'architettura univoca e standardizzata per l'incasso di qualunque debito di natura tributaria ed extratributaria effettuato con una varietà di sistemi e di intermediari di pagamento. Tale sistema migliorerebbe il rapporto cittadino-amministrazione e l'ottimizzazione del processo di pagamento e di controllo di tutte le fasi legate alla riscossione e rendicontazione. La transazione dovrebbe essere effettuata previa identificazione del debito da saldare (l'utente identificato può visualizzare la propria posizione debitoria interrogando la piattaforma di riscossione), ovvero mediante pagamento spontaneo. La piattaforma dei pagamenti dovrà provvedere alla notifica dell'avvenuto pagamento. Dovrà consentire ai cittadini di effettuare pagamenti usando il canale web, attraverso la rete degli intermediari (SISAL, Tabaccherie, Banche, Poste, ecc.) e con qualsiasi strumento di pagamento."",";;;;;;;
"RFB_390, ,Ente Pubblico,Comune,ISIA,BA,Gioia Del Colle,Geolocalizzazione interattiva finalizzata alla fruibilità del territorio per disabili motori,""La struttura urbanistica del Comune di Gioia del Colle,  caratterizzata da aree più moderne e da altre di carattere storico,  è contraddistinta, specie nelle zone antiche e di maggior interesse turistico, da numerose barriere architettoniche che rendono particolarmente problematica la fruibilità del territorio da parte degli utenti con disabilità motoria.   Pur non potendo intervenire, spesso per ragioni di vincolo architettonico o di carattere economico, sull'abbattimento completo delle barriere, data la sensibilità del Comune di Gioia del Colle alle problematiche sociali,  si intende aumentare la qualità della vita dei cittadini a limitata capacità di deambulazione  offrendo loro strumenti TIC che  segnalino opportunamente la presenza di  tali ostacoli,  permettendo di individuare percorsi alternativi per il raggiungimento del luogo di interesse contribuendo a soddisfare le esigenze di 'indipendent living' . ";;;;;;;
;;;;;;;
La soluzione da ricercare dovrà avere un  grado di 'usability' tale da poter essere impiegata da tipologie di utenti eterogenee (giovani, anziani, disabili in carrozzella, utenti con ridotta capacità motoria,..) fornendo  una mappatura dinamicamente aggiornabile sulla presenza di ostacoli anche temporanei (es: cantieri stradali, zone impraticabili,') e proponendo percorsi alternativi  compatibili con la disabilità dell'utente richiedente.;;;;;;;
;;;;;;;
"Non esiste ad oggi una soluzione standard ed è indispensabile sperimentare approcci TIC che consentano una verifica sul campo che tenga conto delle specifiche esigenze del Comune di Gioia del Colle. E' necessaria pertanto una fase di indagine che coinvolga l'attività di mappatura a sostegno della mobilità dei soggetti sensibili e la sperimentazione comparata di applicativi software."",";;;;;;;
"RFB_753,Agenzia Puglia Imperiale Turismo Del Patto Territoriale Nord Barese-Ofantino A R.L.,Soggetto del sistema socio economico regionale,Altro,BCUT,BAT,Trani,Gestione e monitoraggio informatizzato dei flussi nei siti turistico-culturali,""L'area territoriale di Puglia Imperiale è caratterizzata dalla presenza di numerosi ed importanti beni culturali ed ambientali apprezzati e visitati da turisti di tutto il mondo. In effetti, si può dire che l'area in questione è tra le più importanti della Regione per il turismo culturale e naturalistico, potendo contare sulla presenza dei più importanti castelli federiciani, di splendide cattedrali romaniche, siti naturalistici, musei ed aree archeologiche.";;;;;;;
La gestione di tale immenso patrimonio culturale e ambientale nelle diverse città è demandato a svariati soggetti, essendo tali beni di proprietà dello Stato, dei Comuni, delle Diocesi, dei privati, ecc.; cosa che ne impedisce di fatto qualunque forma di gestione collaborativa e di promozione integrata. ;;;;;;
Da tale situazione derivano diseconomie gestionali e di sistema dovute in particolare a:;;;;;;;
"'	Scarsa conoscenza da parte dei turisti dell'intera offerta turistico-culturale presente nelle città, con conseguente riduzione dell'utenza al di sotto dei limiti minimi in grado di garantire condizioni di equilibrio gestionale";;;;;;;
"'	Distribuzione non omogenea dei flussi turistici tra i diversi attrattori, spesso non corrispondente all'effettivo valore storico culturale dei beni, che privilegia la maggiore notorietà di alcuni beni dovuta a fattori i più diversi, a scapito di altri che sarebbero ugualmente interessanti per il target turistico";;;;;;;
"'	Difficoltà per la destinazione di poter incidere in modo efficace nell'indirizzare i flussi turistici verso gli attrattori del territorio, nel garantire un maggiore tempo di permanenza dei turisti in città e persino di conoscere le preferenze e le abitudini di consumo dei propri visitatori.";;;;;;;
Per ovviare a tale deficit strutturale del nostro territorio è auspicabile la realizzazione di un sistema innovativo ed automatizzato per la gestione e il monitoraggio informatizzato dei flussi turistici nei siti turistico-culturali, attraverso sistemi di ICT collegati ad adeguati circuiti di incentivazione per i visitatori, che siano in grado di raccogliere e mappare le anagrafiche dei turisti in visita sul nostro territorio, tracciarne gli spostamenti e i consumi durante la permanenza in loco ed elaborare in forma automatica ed in tempo reale informazioni utili e statistiche di fruizione.;;;;;;;
",
RFB_342,A.L.I.Ce. ? Puglia - Onlus,Soggetto del sistema socio economico regionale,Associazione,ISIA,LE,Galatina,Gestione ecura dei soggetti deospedalizzati da parte di associaz. qualif. x l'assistenza domiciliare,La riduzione dei giorni di ricovero nella struttura ospedaliera, potenziando percorsi integrati di cure domiciliari per soggetti fragili dimissibili una volta definito il percorso terapeutico, può rappresentare un'opportunità per ridurre i costi del ricovero nella struttura ospedaliera. Spesso i pazienti vengono trattenuti nella struttura ospedaliera, oltre il tempo necessario, a causa di mancanza di assistenza territoriale integrata, che sarebbe lo strumento più idoneo per una presa in carico globale del paziente anche di quello con patologie complesse, attivando un rapporto virtuoso tra struttura ospedaliera e territorio. Questa necessità è tanto più forte quando la riferiamo a soggetti affetti da patologie invalidanti importanti come l'ictus cerebrale che rappresenta la condizione tra le più sfavorevoli dal punto di vista clinico, determinando la necessità di cure complesse, integrate e multidirezionali.";;;;;;;
Per far fronte a questo problema, nella prospettiva di Continuità delle cure Ospedale/Territorio, si avverte la necessità di creare un SISTEMA INFORMATIZZATO accessibile a tutti gli attori/operatori afferenti alle organizzazioni ONLUS che si occupano di assistenza domiciliare e cure integrate nel territorio che entrano in contatto con il paziente.;;;;;;;
Il Sistema Informatizzato ipotizzato potrebbe consentire di raccogliere tutte le informazioni mediche e socio-sanitarie sul paziente, dal momento delle dimissioni dall'ospedale, fino al termine del percorso terapeutico, sia esso riabilitativo, infermieristico o semplicemente medico.Tali informazioni riguardano il passaggio di consegne tra il reparto ospedaliero e l'associazione che eroga il servizio di assistenza domiciliare con presa in carico, i dati relativi al progetto terapeutico contenenti la definizione delle procedure, gli strumenti e le tecniche da utilizzare, gli obiettivi da raggiungere, le verifiche intermedie e finali dei risultati, l'eventuale ricalibrazione del progetto terapeutico in itinere. ;;;;;;;
In questo modo si potrebbe;;;;;;;
-Gestire e raccogliere tutti i dati relativi al numero e tipologia di interventi effettuati a favore del cittadino, non solo quelli effettuati a domicilio ma anche nelle strutture del distretto Socio-Sanitario per i controlli di medicina specialistica fin;;;;;;;
-Evitare duplicazioni di atti e fogli aumentando l'efficacia dell'intervento post-ospedaliero, riducendo la burocrazia e il tempo/operatore, ottimizzando l'intervento nei riguardi del paziente attraverso l'utilizzo di un'unica fonte di informazione.;;;;;;;
-Realizzazione della effettiva presa in carico globale del paziente che viene costantemente monitorato attraverso i dati messi a disposizione degli operatori che si alternano a domicilio ed integrati dalle nuove informazioni immesse nel Sistema, man mano ;;;;;;;
",
RFB_759,Aiccre - Associazione Italiana Del Consiglio Dei Comuni E Delle Regioni D'Europa,Soggetto del sistema socio economico regionale,Associazione,GEPA,BA,Bari,gestione ed ottimizzazione degli asset patrimoniali dei comuni,La soluzione auspicata  deve poter garantire  una analisi dei dati relativi alle tendenze e alle anomalie principali, eseguendo previsioni sulle problematiche che potrebbero incidere sull'affidabilità e prendendo decisioni sulla base delle prospettive future.   Ecco alcune delle funzioni principali richieste sono relativi a:";;;;;;;
"'	Ordini di lavoro - pianificazione delle attività, assegnazione del personale, accantonamento dei materiali e registrazione dei costi.";;;;;;;
"'	Manutenzione preventiva   monitoraggio delle ispezioni e dei lavori di manutenzione preventiva, anche con istruzioni passo passo o liste di controllo, distinte dei materiali necessari e altre informazioni ad esse collegate.";;;;;;;
"'	Gestione delle risorse - registrazione dei dati relativi alle attrezzature e alle proprietà, con indicazione delle specifiche, delle informazioni sulle garanzie, dei contratti di assistenza tecnica, dei pezzi di ricambio, della data di acquisto e della vita utile prevista.";;;;;;;
"'	Controllo del magazzino - gestione dei pezzi di ricambio, degli attrezzi e degli altri materiali, compreso l'accantonamento dei materiali stessi.";;;;;;;
"'	Funzioni avanzate di reporting e analisi - creazione di report e analisi personalizzate utilizzabili per la previsione delle problematiche che potrebbero verificarsi, in modo da poter intervenire tempestivamente.";;;;;;;
"'	Registrazione ed archivio documentale che  permette di salvare e catalogare documenti, associandoli ad asset, articoli di magazzino, sistemi e a ciascun oggetto presente";;;;;;;
;;;;;;;
AI fini sperimentali si prevede di gestire al minimo: ;;;;;;;
;;;;;;;
"1.	Scuole Comunali ";;;;;;;
"2.	Strutture Sportive ( Palazzetto, Campi ) ";;;;;;;
"3.	Trasporto Pubblico ";;;;;;;
"4.	Area PIP ";;;;;;;
"5.	Cimitero ";;;;;;;
"6.	Verde Pubblico ";;;;;;;
"7.	Parco Macchine ";;;;;;;
"8.	Immobili";;;;;;;
",
RFB_622,Confagricoltura Foggia,Soggetto del sistema socio economico regionale,Associazione,ASTT,FG,Foggia,Gestione georeferenziata dei terreni agricoli,""Si evidenzia la necessità di disporre di un applicativo web in grado di consentire la gestione georeferenziata dei terreni agricoli impiegati in produzioni biologiche, il controllo delle variabili produttive e la conseguente elaborazione statistica dei dati secondo i più avanzati criteri di business intelligence"""".";;;;;;;
Necessità della creazione di uno strumento ITC, operante in modalità cloud computing (sia su pc che su tablet e smarthphone), dovrà essere di supporto ad un monitoraggio continuo dei parametri agronomici utili sia all'imprenditore agricolo sia, nell'ambito di una filiera produttiva o di un'organizzazione di produttori, ai tecnici responsabili della conduzione agronomica.;;;;;;;
La necessità è quella di monitorare lo stato produttivo degli appezzamenti, con particolari relativi alla coltura impiantata, alla tipologia d'impianto, agli interventi e alle lavorazioni effettuate, agli eventi meteorologici che accompagnano la campagna produttiva, alle verifiche in campo effettuate nei diversi stadi di sviluppo della coltura, fino alla raccolta (quaderno di campagna). ;;;;;;;
"L'obbiettivo è quello di creare un sistema efficiente di tracking ed informazioni finalizzato a supportare gli agricoltori e le imprese agricole sul territorio con informazioni inerenti la gestione operativa e di utilizzo di risorse nelle loro attività."",";;;;;;;
"RFB_435, ,Ente Pubblico,Comune,ASTT,LE,Alliste,GESTIONE INTELLIGENTE DEI RIFIUTI DA RISTORAZIONE,""Uno dei fattori che incidono sul livello basso di raccolta differenziata di alcuni comuni pugliesi, in particolare di quelli come Alliste che hanno forti differenze tra presenze invernali ed estive, è la gestione poco incisiva della stessa nelle marine comunali. Quanto detto è maggiormente provato se si tiene conto che le marine comunali sono forti attrattori di eventi folcloristi e di numerose attività commerciali stagionali che di per se sono moltiplicatori 'naturali' della quantità di rifiuti prodotti. I rifiuti prodotti dalle attività della ristorazione  e  dalle sagre, che rappresentano in queste realtà una quota considerevole dei rifiuti prodotti in estate,  devono essere correttamente monitorati e gestiti, anche in ragione del fatto che si tratta di rifiuti speciali assimilati e che è sempre più importante, per i bilanci comunali, individuare con esattezza la quantità e la qualità di rifiuti speciali che sono assimilati e quindi a carico del servizio pubblico e quali no.";;;;;;;
Le nuove tecnologie dovrebbero dare risposta a questI fabbisognI:;;;;;;;
monitorare in maniera semplice in qualità e quantità i rifiuti da ristorazione (questo monitoraggio servirebbe anche a calibrare in maniera più razionale i parametri di assimilazione del rifiuto).  ;;;;;;;
Assegnare ad ogni attività il quantitativo di rifiuti prodotti e la suddivisione per materiale;;;;;;;
Collegare il pagamento della TARSU (o tariffa) e di eventuali servizi aggiuntivi alle quantità e qualità monitorate ;;;;;;;
Collegare il comportamento in tema di gestione rifiuti alle richieste di occupazione suolo pubblico per attività di ristorazione all'aperto;;;;;;;
Assegnare ad ogni attività bonus, sgravi  in relazione alla virtuosità della gestione rifiuti .;;;;;;;
",
RFB_771, ,Ente Pubblico,Comune,TRMO,BA,Bitonto,Gestione Parcheggio QR-Code,Implementazione del servizio di sosta a pagamento mediante la fornitura, all'acquisto, di tagliandi che, per mezzo della tecnologia QR-Code, consentano il prolungamento della sosta, senza dover ritornare nel luogo in cui è parcheggiata la propria auto."",";;;;;;;
RFB_812, ,Ente Pubblico,Comune,GEPA,BA,Putignano,GESTIONE PARCO INFORMATICO E MONITORAGGIO HARDWARE E SOFTWARE,Il sistema informatico comunale necessita di un costante monitoraggio delle postazioni  sia per quanto riguarda l'hardware che il software e le relative licenze per la razionalizzazione dell'approvvigionamento e la gestione del parco informatico.,;;;;;;;
"RFB_572, ,Ente Pubblico,Comune,ASTT,LE,Zollino,Gestione Smart dei Rifiuti,""In materia di tutela ambientale e territoriale, assume dimensione sempre più rilevante il tema della corretta informazione e comunicazione sul ciclo di raccolta e smaltimento dei rifiuti. Si evidenziano, in particolare, problematiche relative a:' Rifiuti abbandonati (realtà che da sempre danneggia l'ambiente)";' Scarsa informazione sulla raccolta differenziata;' Scarsa informazione per la raccolta dei rifiuti speciali, ingombranti e RAE; Si ritiene che nuove metodologie di comunicazione (ispirate anche alla metafora del social network), unitamente allo sviluppo di soluzioni applicative di tipo 'smart', possano contribuire positivamente alla mitigazione delle predette problematiche, mettendo a disposizione dell'utenza un canale informativo ed interattivo per fornire indicazioni utili in ordine a:' Raccolta differenziata (database nel quale cercare e individuare un determinato rifiuto e sapere in quale bidone va conferito, quando e dove si trova il bidone);' Rifiuti ingombranti e/o RAE: l'utente dovrà avere a disposizione un calendario, grazie al quale potrà sapere come, dove e quando avviene il ritiro dei rifiuti ingombranti e RAE. Inoltre dovrà essere possibile contattare il supporto (telefonicamente o via mail) e richiedere informazioni o orari. Dovrà inoltre essere possibile inviare foto o descrizione del rifiuto da smaltire per il quale deve essere richiesto il ritiro, in modo da rendere più facile, per l'operatore, sapere di che tipo di supporto l'utente ha bisogno;' Rifiuti speciali: l'utente dovrà essere informato e sensibilizzato relativamente a questo tipo di rifiuto. In particolar modo dovranno essere studiate forme e modalità di informazione circa le modalità di smaltimento;' Eco-centri, piattaforme, dovrà essere possibile dare all'utente la possibilità di sapere dove si trovano e gli orari di funzionamento delle piattaforme e gli eco-centri, in modo da mettere lo stesso nelle condizioni di poter individuare e raggiungere la destinazione.;
Infine, un sistema di videosorveglianza nelle aree soggette a discariche abusive  ed in tutte le arre di criticità urbanistica, consentirebbe di migliorare la qualità della vita e la sicurezza.;;;;;;;
",
RFB_346, ,Ente Pubblico,Comune,ASTT,LE,Lecce,Gestione Smart dei Rifiuti,In materia di tutela ambientale e territoriale, assume dimensione sempre più rilevante il tema della corretta informazione e comunicazione sul ciclo di raccolta e smaltimento dei rifiuti. Si evidenziano, in particolare, problematiche relative a:";;;;;;;
' Rifiuti abbandonati (realtà che da sempre danneggia la nostre città);;;;;;;
' Scarsa informazione sulla raccolta differenziata in città;;;;;;;
' Scarsa informazione per la raccolta dei rifiuti speciali, ingombranti e RAE;;;;;;;
;;;;;;;
Si ritiene che nuove metodologie di comunicazione (ispirate anche alla metafora del social network), unitamente allo sviluppo di soluzioni applicative di tipo 'smart', possano contribuire positivamente alla mitigazione delle predette problematiche, mettendo a disposizione dell'utenza un canale informativo ed interattivo per fornire indicazioni utili in ordine a:;;;;;;;
' Raccolta differenziata (database nel quale cercare e individuare un determinato rifiuto e sapere in quale bidone va conferito, quando e dove si trova il bidone);;;;;;;
