CODICE,DENOMINAZIONE_RICHIEDENTE,CATEGORIA,TIPOLOGIA,DOMINIO_RIF,PROVINCIA_SEDE,COMUNE_SEDE,TITOLO,MANIFESTAZIONE_INTERESSE,CODICI_EQUIVALENTI;;;;;;;
"-	Il contesto storico e antropologico";;;;;;;
"-	La vita quotidiana: gli insediamenti, gli utensili, i santuari";;;;;;;
"-	L'arte e i monumenti preistorici: i dipinti, , i dolmen, i menhir.";;;;;;;
Esempi del genere esistono in Spagna ad Altamira e in Francia a Lascaux, dove tali strutture sono diventati attrattori importantissimi di un turismo-culturale che raggiunge tali siti specificatamente per la visita dei musei presenti.;;;;;;;
Il museo otrantino, potrebbe diventare uno degli strumenti più idonei per raggiungere quell'obiettivo importantissimo di coniugare tutela ambientale, storia, cultura e marketing territoriale, trasformando la risorsa da vincolo in opportunità. Occasione, dunque, di crescita eco-sostenibile e opportunità di sviluppo attraverso uno strumento strategico per destagionalizzare i flussi turistici, fornendo un ulteriore itinerario alternativo, dal suggestivo appeal e dall'alto profilo culturale, che ci promuoverebbe su uno scenario culturale europeo.;;;;;;;
La realizzazione di tale museo, permetterebbe di valorizzare patrimoni di inestimabile valore rendendoli disponibili per una divulgazione a larga scala. ;;;;;;;
",
RFB_192,Il Meridiano Societa' Cooperativa,Soggetto del sistema socio economico regionale,Cooperativa,ISED,BA,Bari,N.O.D.I. - NUOVI ORIZZONTI DIDATTICI INNOVATIVI,L'innovazione nella didattica comporta l'uso di strumenti digitali evoluti e lo sviluppo di reti sociali e di opportunità che vadano oltre i confini stessi delle conoscenze attualmente erogate dalle scuola. Essa è un'esigenza sempre più diffusa nel territorio nazionale e pugliese,dimostrata dalla creazione di ScuoleSmart, sostenute dal MIUR e dalla Regione Puglia.Ciò incontra la necessità di  nuovi saperi e di nuovi bisogni di saperi, così come di nuovi campi di dominio dell'Istruzione e della Formazione, in una prospettiva di cittadinanza attiva.L'interesse è per il mismatching di domanda/offerta di sapere/lavoro,attraverso l'uso di tecnologie avanzate e di soluzioni e software, applicazioni, social learning e produzione di format per web tv e web radio per l'apprendimento interattivo in rete.In questo scenario,la mappatura del bisogno educativo e didattico ed il  potenziamento delle capacità e abilità tecniche e di base nelle scuole, con soluzioni innovative, è il requisito essenziale perché l'applicazione di soluzioni 2.0 possa avere successo.Partendo dal bisogno espresso/rilevabile, si svilupperà la costruzione e realizzazione di percorsi di ricerca-azione (attraverso focus groups/laboratori GOPP/Delphi) in cui i partecipanti stessi -studenti, docenti, dirigenti scolastici, cittadini- forniranno un'indicazione delle aree di intervento.Lo scopo sarà di sperimentare metodologie di didattica e di ricerca laboratoriale, che vedranno la partecipazione attiva dei diversi attori coinvolti già in fase di progettazione, gestione e conduzione dei laboratori, ed anche nell'organizzazione dei contenuti, in una prospettiva di rete reale da tradurre, in una seconda fase, nel laboratorio sociale. In tal senso, si opererà il superamento dell'impostazione top-down (docente/discente, ricercatore/investigato) e si favorirà la rilevazione partecipata del bisogno e delle prospettive di risposte dello stesso. Esito della rilevazione sarà la costruzione di un set di ipotesi di risposta innovativa ai bisogni rilevati, applicabili al contesto scolastico e territoriale circostante, alle vocazioni e condizioni territoriali (segmenti produttivi convergenti con la scuola e l'offerta didattica, bisogni sociali convergenti con i bisogni della scuola, etc.)."",";;;;;;;
"RFB_218,Aspnat Onlus (Associazione Per Lo Studio E La Prevenzione Delle Nefropatie-Alto Tavoliere),Soggetto del sistema socio economico regionale,Associazione,ISIA,FG,San Severo,Nephron-app,""I pazienti nefropatici hanno necessità di seguire, secondo lo stadio della malattia, una corretta alimentazione, sia nella fase di malattia renale cronica (MRC), sia in presenza di insufficienza renale cronica (IRC) conclamata. Infatti, alcuni elementi, quali fosforo, calcio, sodio e potassio, possono creare gravi problemi se presenti in eccesso o in difetto, con pericolose conseguenze sulla salute. L'alimentazione ha la funzione di nutrire l'organismo ma anche di migliorare la qualità di vita del paziente nefropatico, permettendo di ridurre alcuni dei sintomi associati alla patologia quali stanchezza, crampi, insonnia. ";;;;;;;
"ASPNAT ha già prodotto una pubblicazione con suggerimenti nutrizionali per pazienti nefropatici. Il fabbisogno è quello di rendere tali consigli più fruibili agli Utenti, grazie ad una applicazione free per smartphone (Nephron-app). Ciò consentirebbe di avere facilmente a disposizione ovunque, a casa e fuori, e in qualunque momento, una valida guida di ausilio nelle scelte alimentari."",";;;;;;;
"RFB_429, ,Ente Pubblico,Comune,BCUT,LE,Casarano,Networked Cultural Heritage Discoverer,""archiviazione digitale e divulgazione di contenuti storico-artistici, valorizzazione di percorsi storico artistici, culturali e sociali"",";;;;;;;
"RFB_332, ,Ente Pubblico,Provincia,ENER,FG,Foggia,New Energy Park (NEP),""L'obiettivo da raggiungere è :";;;;;;;
1) fondare una concreta coscienza e conoscenza per la produzione e l'utilizzo dell'H2 direttamente da mini-impianti installati presso i singoli cittadini, piccole comunità ed in accordo coi migliori principi di design, efficienza, ed applicazioni provenienti da energie rinnovabili (eolico ' fotovoltaico) da utilizzarsi come vettore energetico (energia termica ' elettrica) raccolto e distribuito in mini-reti e depositi tra loro comunicanti ed interagenti per provvedere a sopperire ai consumi e necessità energetiche proprie creando scorte da re-indirizzare e utilizzare ai bisogni energetici dell'intera collettività.;;;;;;;
2) trasformare il consumatore di energia in potenziale ed attivo produttore, capace di sopperire con la propria produzione allo specifico fabbisogno e a quello della intera comunità.;;;;;;;
3) creare professionalità capaci di conoscere, gestire e intervenire sugli impianti con l'ausilio di sistemi informatici ed innovativi per la gestione e controllo anche a distanza della migliore efficienza di produzione, conduzione, sicurezza stoccaggio e gestione delle scorte energetiche;;;;;;;
4) disporre l'unificazione degli standard per la generazione e l'impiego dell'idrogeno, dei relativi processi di installazione-distribuzione, e dei materiali da utilizzarsi, regolamentando ogni disposizione in materia di sicurezza quale efficace metodologia indirizzata ad uno standard di certificazione in ambito regionale,nazionale ed europeo puntando ad una legislazione favorevole ad incentivare e promuoverne la diffusione di tale tecnologia;;;;;;;
5) attivare una soluzione intelligente di  finanziamento capace di non richiedere alcun investimento iniziale al consumatore e di permettere allo stesso l'autofinanziamento per tramite dell'energia prodotta, dell'efficienza dell'impianto e del risparmio energetico, contribuendo con tali strumenti alla crescita di PIL e contribuire ad ottenere i risultati di riduzione di CO2 previsti dal protocollo di Kyoto.;;;;;;;
",RFB_369
RFB_281, ,Ente Pubblico,Comune,ISIA,FG,Casalvecchio Di Puglia,Nuove ITC,Monitoraggio dei bisogni attraverso i sistemi delle nuove tecnologie delle fasce deboli della popolazione, quali anziani, diversamente abili, ecc.";;;;;;;
"Oltre al monitoraggio dare la possibilità ai soggetti con disabilità fisiche, psichiche e sensoriali di poter accedere tramite strumentazioni tecnologiche nello specifico """"nuove tecnologie assistive"""" alle informazioni di carattere generale nonchè di carattere socio-sanitario abbattendo il divario esistente """"digital divide"""" verso la promozione del """"digital include"""""",";;;;;;;
"RFB_609,Scuola Edile Della Provincia Di Lecce,Soggetto del sistema socio economico regionale,Altro,ISED,LE,Lecce,Nuove metodologie per l'apprendimento,""Interesse dalla Scuola edile della provincia di Lecce è di sperimentazione nuove metodologie per l'apprendimento, soprattutto attraverso l'e-learning, strategie che sicuramente potranno migliorare l'interesse e promuovere nuove esperienze all'interno del contesto formativo.";;;;;;;
L'uso dell'elearning consente di ripensare l'apprendimento in una chiave evolutiva, con una dinamica di partecipazione all'interno di comunità aziendali e professionali, che riproducono saperi e identità condivise, attraverso modalità diverse, quali: 1) asincrona attraverso la fruizione di contenuti; 2)sincrona attraverso l'utilizzo di chat e videoconferenze;" 3) collaborativa attraverso le molteplici attività partecipative delle 'comunità virtuali. La scuola sente l'esigenza di: - uscire dall'aula e diventare capace di operare su un maggior numero di persone anche a costi più contenuti, - rendere possibile la formazione sul posto di lavoro grazie soprattutto all'utilizzo di intranet, Internet, interactive desktop, videoconferencing ecc, - integrare aspetti formativi ed aspetti organizzativi delle risorse umane: reclutamento, selezione, valutazione, sviluppo, comunicazione interna, amministrazione, adozione di sistemi premianti, monitoraggio e miglioramento continuo. Importante potrà essere fornire formazione on demand, integrata con la formazione tradizionale in presenza, supportata da relazioni individuali di tutoring utili per sviluppare competenze."",";;;;;
"RFB_815, ,Ente Pubblico,Comune,GEPA,BR,Brindisi,Open Data,""Il Comune di Brindisi opera già nel rispetto della normativa prevista dal Decreto Legislativo 33/2013 che ha riordinato la disciplina sugli obblighi di pubblicità, trasparenza e diffusione di informazioni da parte delle Pubbliche Amministrazioni. Come previsto dal decreto legislativo, la sezione """"Trasparenza, valutazione e merito"""" è sostituita da """"Amministrazione trasparente"""".";;;;;;;
Sarebbe utile integrare a tali principi un sistema di OPEN DATA mantenendo il principio fondamentale che i dati pubblici, nel rispetto della normativa vigente, appartengono alla collettività e come tali possono essere ri-utilizzabili da chiunque ne abbia interesse.;;;;;;;
Elementi fondamentali per la diffusione di tali dati sono: ;;;;;;;
- riduzione delle restrizioni con l'applicazione di formati standard e aperti;;;;;;;
- utilizzo di strumenti standard attraverso l'adozione di licenze improntante al sistema di licenze Creative Commons (cioè senza diritti d'autore);;;;;;;
- gratuità della ri-utilizzabilità e della re-distribuibilità dei dati.;;;;;;;
"Con l'utilizzo degli OPEN  DATA il Comune di Brindisi potrà valorizzare il proprio patrimonio informativo e la diffusione dei dati permetterà di favorire la democrazia partecipativa, agevolare la ricerca e favorire lo sviluppo di imprese specializzate."",";;;;;;;
"RFB_596, ,Ente Pubblico,Comune,GEPA,LE,Martignano,Open governement e trasparenza,""Il Comune ha la necessità di aumentare il proprio livello di trasparenza nei confronti dei cittadini puntando a condividere in modo continuo lo stato dei provvedimenti amministrativi e delle discussioni consiliari sui temi strategici edi maggiore impatto sulla quotidianità, come ad esempio ambiente, mobilità urbana, etc.";;;;;;;
E' necessario operare  in modo da informare e allo stesso tempo coinvolgere la cittadinanza attraverso strumenti ad elevata interattivività che consentano ad ogni singolo cittadino di esprimere parere, spunti critici ed osservazioni rispetto all'operato del Comune ed alle decisioni in fieri dell'Ente.;;;;;;;
",
RFB_310,Agenzia Per Il Patrimonio Culturale Euromediterraneo,Soggetto del sistema socio economico regionale,Associazione,BCUT,LE,Lecce,OPENBi. Rete della conoscenza bibliotecaria pubblico privata,L'accelerazione del dialogo tra i cittadini (residenti e non) e gli attori istituzionali impegnati nello sviluppo dei territori rende necessario ed urgente la creazioni di una piattaforma della conoscenza condivisa e fruibile da parte di tutti i cittadini.";;;;;;;
E' dunque importante creare le basi di nuovi motori per l' interlocuzione tra gli attori vivi del territorio che riesca ad essere anche un volano, reale e concreto, per lo sviluppo non solo culturale ma anche economico della nostra terra.;;;;;;;
Enti, istituti di ricerca, biblioteche (sia pubbliche ed in particolare quelle private) devono necessariamente  moltiplicare la rete delle loro relazioni in funzione delle crescenti opportunità offerte non solo dall' innovazioni tecnologiche ma anche dallo scambio 'open' di conoscenza.  La frammentazione e la discontinuità di questo fondamentale dialogo tra cittadini ed soggetti pubblici, come i musei o le biblioteche ed i privati 'custodi' di una parte importante del patrimonio di conoscenza, necessita di un sistema di  facilitatori (strumenti ICT) estremamente dinamici e accessibili che sappiano massimizzare il valore, non solo relazionale ma soprattutto culturale, che una condivisione allargata dei rispettivi patrimoni di 'know-how' può garantire ai nostri territori.;;;;;;;
;;;;;;;
Il progetto OPENBi ha come obiettivo ampliare il patrimonio di conoscenza pubblico, presente nelle realtà locali delle nostre biblioteche, con quello rinvenibile nelle biblioteche dei privati e metterle in rete, attraverso gli strumenti ICT, creando così una piattaforma della conoscenza aperta e condivisibile. Il progetto poi andrà oltre la semplice catalogazione e fruizione tramite mobile-app di ciò che già è stato raccolto, convogliando tutti i partner che decideranno di raccogliere la sfida,  verso nuove occasioni di sviluppo  al fine arricchire il background delle aziende che insistono sul nostro territorio.;;;;;;;
;;;;;;;
Tramite il progetto OPENBi si riuscirà dunque a far fronte a quel comune senso di appartenenza che contraddistingue uno sviluppo sano e duraturo.;;;;;;;
",RFB_339
RFB_327, ,Ente Pubblico,Comune,ISIA,BA,Bari,Osservatorio d'ambito,Un nodo problematico emerso durante la redazione del Piano Strategico di Area vasta BA 2015 è sicuramente rappresentato dall'assenza di strumenti uniformi per una rilevazione ed una lettura sistematica dei bisogni emergenti sul territorio, oltre ad un problema di 'sistema' legato all'inefficienza del sistema informativo relativo all'accesso ai servizi socio sanitari, che costituisce una prima fonte di grave disagio per gli utenti e per i cittadini.      Criticità rivenienti dal flusso informativo tra uffici periferici (Circoscrizioni) e l'ufficio";;;;;;;
centrale (Ripartizione): appare necessario realizzare uno sforzo notevole per far sì che si;;;;;;;
crei un flusso informativo ' sia in entrata sia in uscita da ambo i lati ' tra tutti gli uffici;;;;;;;
interessati alle attività del Piano Sociale di Zona; medesima criticità si riscontra anche tra;;;;;;
le diverse Ripartizioni del Comune e tra i Comuni di Area Vasta;;;;;;;
È determinante realizzare un osservatorio sociale dell'Ambito: la carenza di;;;;;;;
"informazioni, l'assenza di una raccolta sistematica dei dati relativi agli utenti ed ai servizi causa disservizi, ritardi non comprensibili ai cittadini."",";;;;;;;
"RFB_393,Protezione Civile,Ente Pubblico,Altro,ASTT,BA,Bari,OTTIMIZZAZIONE DELLE PROCEDURE DI RACCOLTA DELLE INFORMAZIONI ATTRAVERSO SISTEMI INTERATTIVI,""La gestione organizzativa e funzionale del sistema di allertamento regionale per il rischio idrogeologico ed idraulico ai fini di protezione civile avviene sulla base degli 'Indirizzi operativi' stabiliti dalla Direttiva del Presidente del Consiglio dei Ministri 27.02.2004 e s.m.i. ed il relativo servizio è svolto dalla rete dei Centri Funzionali (Centro Funzionale Centrale-CFC presso il Dipartimento della protezione civile e Centri Funzionali Decentrati-CFD regionali) secondo una fase di previsione (assimilazione dei dati osservati, previsione degli effetti al suolo e valutazione del livello di criticità atteso) ed una fase di monitoraggio e sorveglianza, da svolgere anche per il tramite dei Presidi territoriali, idrogeologici ed idraulici, per quanto attiene all'attività di reperimento in loco di informazioni, strumentali o meno, che consentano di formulare e/o di confermare gli scenari previsti e di aggiornarli a seguito dell'evoluzione dell'evento in atto.";;;;;;;
Le attività dei richiamati Presidi territoriali richiedono una efficace e tempestiva raccolta e successiva comunicazione delle informazioni progressivamente raccolte sul territorio in corso di evento, ai fini di un conseguente utile processamento presso il Centro Funzionale Decentrato regionale.;;;;;;;
A tali fini si ritiene utile sperimentare processi che riescano a coinvolgere soggetti presenti sul territorio ( operatori specializzati, ma anche cittadini,  agricoltori, etc.), i quali avvalendosi anche di strumenti di comunicazione tipo tablet, smartphone e altro, possano contribuire alla raccolta e trasmissione di informazioni utili quali la geolocalizzazione dell'evento, immagini fotografiche e video, eventuali dati descrittivi ed alfanumerici resi secondo format prestabiliti. Le informazioni raccolte dovranno essere successivamente processate ai fini di una efficace integrazione con il complesso di ulteriori dati raccolti con alcuni sistemi già disponibili e trattati presso il CFD regionale.;;;;;;;
",
RFB_474,""Officine Culturali"""" - Ricerca, Documentazione, Cultura E Promozione"",Soggetto del sistema socio economico regionale,Associazione,ISED,LE,Carpignano Salentino,Out-door per la formazione e progettazione e valutazione dell'intervento e dei processi formativi,""Gli associati di """"Officine culturali"""" e gli altri operatori culturali del territorio (enti no-profit, associazioni e cooperative che cooperano con la nostra associazione) necessitano di formazione riguardo la tematica della progettazione e valutazione dell'intervento e dei processi formativi, nonchè di una adeguata conoscenza del modello di formazione out-door per i membri interni e per lo sviluppo di progetti che riguardano i nessi, per noi strettissimi, tra comunità, contesto di riferimento geografico e la sua promozione. Le arti performative supportate dalle ICT e da modelli di formazione out-door adeguati al contesto di riferimento in cui opera """"Officine Culturali"""" possono, alla fine di un percorso formativo/espressivo/esperienziale, promuovere empowerment individuale e comunitario. Coloro che svolgono lavoro di cura (docenti, assistenti sociali, educatori, psicologi) ricavano dalla conoscenza dei dispositivi propri del """"Teatro sociale di comunità"""" elementi funzionalil ad interventi su gruppi più o meno ampi per incrementare il loro senso di auto-efficacia, inducendo processi di riflessività mediata dall'impegno del corpo e delle sue risorse comunicative. Gli operatori culturali, gli organizzatori, gli artisti possono trarre da queste attività formative opportunità per acquisire una sensibilità alla dimensione sociale della loro azione. Carpignano Salentino nel 1974 è stato, grazie ad Eugenio Barba e all'Odin theatret, il luogo dove è nato il """"baratto culturale"""", ovvero lo scambio sostenibile in comunità tra beni della cultura materiali e immateriali. Tradizioni, memorie di comunità, pratiche di bottega, storie di vita rappresentano il patrimonio che """"Officine Culturali"""" vuole salvaguardare e promuovere come dispositivo pedagogico."",";;;;;;;
"RFB_350, ,Ente Pubblico,Comune,GEPA,LE,Lecce,Partecipazione Attiva,""Gli ultimi anni della vita politica italiana hanno determinato una profonda disaffezione dei cittadini verso i partiti e un crollo verticale nei consensi e nella fiducia in quasi tutte le Istituzioni, provocando una sempre minore partecipazione attiva del cittadino alla vita sociale e politica della propria comunità. In una società in cui comunicazione, relazioni e collaborazione diventano aspetti sempre più centrali e importanti, il cittadino ha bisogno di essere ascoltato e informato. Ha bisogno di un sistema di comunicazione con la Pubblica Amministrazione che sia bidirezionale, e che gli consenta di interagire con le istituzioni e di partecipare attivamente alla vita politico-sociale (electronic town meeting).";;;;;;;
Il Comune di Lecce avverte dunque la necessità di aumentare il livello di interazione con la cittadinanza, avendo come principi generali di riferimento la trasparenza e la valutazione continua dell'efficacia della propria azione politica e amministrativa rispetto ai bisogni primari della popolazione.;;;;;;;
Si propone quindi la realizzazione di un portale web che favorisca la partecipazione attiva del cittadino nel processo decisionale delle proprie istituzioni (anche attraverso interfacce intuitive (accessibile tramite pc, tablet, smartphone) e/o l'utilizzo della metafora del gioco) e che: ;;;;;;;
- consenta uno scambio paritario di idee tra un gruppo di persone e le Istituzioni. (es: Io Partecipo!);;;;;;;
- offra l'opportunità di trovare un gruppo tra migliaia già esistenti, in base ad un argomento o interesse (per es. politica, lingue straniere, ecologia, amici) e alla propria città di residenza;;;;;;;
- permetta di segnalare problemi nel proprio quartiere/città (strada dissestata, parcheggio in zona disabili) e di inviare alert alle autorità  competenti, inoltre consente il monitoraggio delle segnalazioni effettuate;;;;;;;
- permetta ai cittadini di sostenere una causa, petizione, class action, ecc, in maniera trasparente;;;;;;;
- consenta la consultazione di documenti ufficiali e di opinioni di altri cittadini, nonché di pubblicare i propri commenti (che dovranno essere automaticamente notificati agli uffici pubblici competenti e al comitato cittadino di riferimento);;;;;;;
In questo modo sarà possibile incentivare la comunicazione e lo scambio culturale tra cittadini ed istituzioni al fine di accrescere le conoscenze di ognuno e migliorare l'ambiente in cui vivono. Il tutto attraverso:;;;;;;;
- open source, cioè di libero accesso;;;;;;;
- open publishing, permettendo di aggiungere notizie o contenuti in maniera trasparente;;;;;;;
- open content, dando la possibilità di copiare o modificare i contenuti pubblici.;;;;;;;
"(Possibili esempi: MeetUp, SeeClickFix, Valma, 'App Io Partecipo')."",";;;;;;;
"RFB_789,Alba Società Cooperativa Sociale Onlus,Soggetto del sistema socio economico regionale,Cooperativa,ISIA,BR,Mesagne,Percorsi integrati di cura,""La Cooperativa è da anni impegnata nell'erogazione di servizi di assistenza domiciliare integrata e non. Per tale attività è anche Certificata ISO 9001:2008. L'assistenza domiciliare è solo l'ultimo nodo di un complesso ripensamento della rete dei servizi sanitari e quindi socio sanitari, che passa attraverso una diversificazione delle strutture ospedaliere che tenga conto dei diversi livelli di cura: ospedali specializzati per interventi chirurgici e cura di patologie acute, strutture di lunga degenza riabilitativa, residenze sanitarie assistenziali, centri diurni, assistenza domiciliare. L'assistenza prestata dalla Cooperativa è rivolta a categorie di persone che diventano sempre più numerose e sempre più bisognose di cure assidue e di lunga durata. Persone, soprattutto anziani non autosufficienti, disabili gravi e gravissimi, malati terminati, ecc., che vivono meglio nelle loro abitazioni e nel contesto della famiglia, non più costretti a continui, troppo lunghi ricoveri nelle strutture ospedaliere.";;;;;;;
Un'assistenza fortemente delocalizzata, che oggi può contare su ambienti e tecnologie sperimentate, come i servizi via web, utilizzabili da pc, da palmare, da telefono cellulare. Come la telemedicina, il telecontrollo e la telediagnosi. Come il digitale terrestre.;;;;;;;
Un'assistenza che comporta una forte componente organizzativa e una forte capacità di progettare soluzioni nuove e di ampio respiro, in linea con l'evoluzione delle esigenze e dei cambiamenti della società. Il bisogno è quello di 'adoperare' conoscendole le tecnologie per agevolare gli operatori nel loro lavoro e costruire un patrimonio informativo, utile anche per il follow up, condiviso con le strutture sanitarie e con gli Enti locali per la loro competenza sociale (ambiti di zona).;;;;;;;
Ciò che servirebbe è un modello organizzativo e di tecnologie che tengano conto di:;;;;;;;
- un sistema per l'organizzazione e il coordinamento delle attività e la valutazione dell'efficacia e dell'efficienza dei servizi erogati che veda attori il SSR, gli enti locali (ambiti di zona).;;;;;;;
- un sistema per le unità di valutazione multidisciplinari, specializzato per la valutazione, la gestione e il controllo di percorsi di cura;;;;;;;
- un sistema di accesso al patrimonio informativo, che garantisca la sicurezza della trasmissione di dati sensibili, accessibile dal domicilio del paziente.;;;;;;;
- integrazione con i sistemi di telemonitoraggio di parametri vitali specifici per patologia, e sperimentazione di tecnologie wireless per la trasmissione dei dati rilevati.;;;;;;;
- progettazione di moduli 'aperti' per l'integrazione con i sistemi socio sanitari regionali (SIST, 118, portale regionale della salute, ecc.).;;;;;;;
",
RFB_751,Gal Fior D'Olivi S.C.R.L.,Soggetto del sistema socio economico regionale,Partenariati Pubblico-Privato,ISIA,BA,Terlizzi,Percorsi rurali del gusto e sana e corretta alimentazione,Il GAL FIOR D'OLIVI s.c.r.l. già impegnato a livello regionale e locale nella promozione sui temi legati allo sviluppo e rivalutazione di percorsi rurali del gusto e della sana e corretta alimentazione è  interessato a introdurre tecnologie e metodologie proprie dei giochi digitali con lo scopo di innovare e rendere più efficace la propria azione di sensibilizzazione sui temi della corretta alimentazione. ";;;;;;;
